tag,text
62943,"recently i've been facing a rough time with my girlfriend, we can't seem to see eye to eye in anything, and we have been quarreling a lot. she have tons of close guy friends and im very insecure when it comes to them, im afraid she starts developing feelings for them because i dont feel like im good enough. she will always assure me in the past but now she just stop doing so. and i start getting suspicious and i want her to report everything to me and she hasn't been reacting too well to it, she thinks im a control freak... i love and trust her but im just so damn insecure.. and i've been hurting her a lot with the words i say and how i react in situations. but i dont want to admit that im in the wrong."
62940,"Is it wise to accept my offer into NUS FASS without a secured spot in Psychology?

I hear Psych is very competitive and that i have to get at least a B- in certain mods to secure a place.

Should i opt for SMU instead?
Any seniors can provide a gauge on how difficult it is to secure a spot in Psych?"
62939,"#62905 Too bad, he's beyond your reach. Go do some research on his background first."
62935,"Really curious about those in the insurance industry, how much do they really earn? I have one or two ex school mates who joined. it’s been a few years now, and it seems like they’re doing really really well. They own houses and cars, that’s makes them more successful than 50% of our batch. The weirdest part is the they even have frequent overseas business trips?? I have no idea what insurance agents do for overseas businesses trips.

I’m stuck in a below average pay engineering job (it’s freaking far cry from the data published for nus engineering fresh grads) for a few years already and am really tempted to join them."
62933,"Apart from the usual didactic modes of teaching with its seemingly compulsory series of examinations, assessments and projects, how else can one begin to learn a specific topic by himself/herself? I became especially interested in history and literature texts recently, but I will not be able to take their introductory modules as I will be graduating after this semester.

Any advice on how to independently read and analyse works within the two fields would be greatly appreciated. If it helps to give some background, I am a science major and previously graduated from the UTCP. Thanks!"
62929,"Hi, no troll here, I am just curious. Do most guys comb hair?

So my boyfriend hasn’t been combing hair since around JC. Not that he looks untidy, he actually looks very neat (and handsome), but he just doesn’t comb his hair. He said he used to comb his hair when he was younger, but at some point in time around JC, he found that there was no need to. So now, he doesn’t even own a comb. I am just wondering if there are guys out there who doesn’t need to comb hair? 

P.S. my boyfriend is not bald"
62928,"I'm currently overseas, and traveling alone without by bf has kept me thinking...

I've only had one hookup prior to my current bf, and that was basically my entire sexual experience. It's awkward seeing the guy I hooked up with in school since it was kinda a series of bad decisions that led me to hook up with him. Then again it was a long time ago, I was immature and hasty. Anyway I'm not sure he remembers me. I just tend to avoid him and his friends in case he remembers, and since my bf knows him too I tend to just leave them alone when they talk in case he remembers what happened between us.

Sometimes I catch myself thinking and wondering if my current bf (who's a virgin) would be as good in bed as my hookup/FWB at the time since he was pretty experienced being a couple years older and having quite a lot of experience. I'm not sure if thinking like this is healthy for my relationship and I don't really know how to stop? It's like I want to stay with my bf, definitely, but I'm just always stuck wondering about the sex? I''m just not sure about what I can do to manage this. Is this normal?"
62927,I am thinking of going to UHC counselling... What can I expect? And does UHC even prescribe medication for mental illness?
62925,"Hi, I’m a rather skinny girl and I have trouble putting on weight regardless of what I eat. So I’m trying to gain muscles instead. But then, I’m really shy to use the weight machines and I got stared at while I was using it as if I am a beginner(because I am really skinny lol). Anyone girls willing to head to the gym with me?"
62924,"[LOST A BLUE WATER BOTTLE AT UTOWN FINE FOOD]

Hello, I have lost a 1-liter water bottle, blue color, have NUS logo on it today Sun 05/05/2019 around lunch time at UTown Fine Food (The first canteen from UTown bus stop). 

I used the bottle to chop a table near the Indian food stall where a group of 4 students (2 girls, one of the girls was wearing a white T-shirt, the other girl was wearing a floral brown shirt and a white short if I'm not wrong & 2 guys) was about to leave. I got ask one of the girls whether they were abt to leave. The girl said yes so I put my water bottle there & go queue at the stall nearby. When I looked back a while later, they have gone together with my water bottle. I have desperately run around for an hour & tried to find for it but it seems to be hopeless.

If anyone accidentally took it, please return to me (you could like or comment this post & I'll pm you). The bottle is very meaningful to me & I really like it. I'll compensate you for that. Thanks a lot in advance!"
62923,"To OP #62923

Calling BS on your confession. Not even the local top brass makes it to entry hedge fund unless you pulled some strings to get there. An analyst position in hedge fund only hires experienced IB/PE with proven track record (min 2-4 years) and easily double the salary there.

Advice to any finance/econ/banking majors - learn well and pick up fast in your internships, and keep in contact with your supervisors. IB wannabes, well you need the entire package down.

- ex-fund associate now consultant. class of '14"
62921,"Dear Steven,

I have been studying so so hard for 2040c, but i don't know what i was thinking during the finals; made simple mistakes that totaled at least -10 marks for section A alone

I was aiming for at least an A-, but am super worried now. What am i going to do?"
62920,Is it bad that I have yet to receive any news for my application for CS? Not even for DA interview. I’m worried as the deadline for acceptance window draws near.
62918,"I'm on dating apps for a while now and seeking only for sincere and long term relationship. I have a fair share of matches, however, I'm beginning to lose faith in the dating scene. It's so hard to find a girl who is sincere and want to be friend with you nowadays. They just come and go and not going to have more conversations with you before cutting you off. Mostly, is a 1 or 2 time reply and boom, they are gone without a trace. Why do they behave in this manner and what are they really seeking out for? Are there still good and sincere girls left or have they all evolved to become players as well? Even those who mentioned 'simple girl' in their profile aren't really simple to begin with. I really hope I can meet a sincere girl soon. Drop me a hint if you are interested to be a friend with me."
62917,"I have always wondered how do people overload and still cope well? Take my CS2107 TA for example, I heard from my friend that he was taking 7 modules but yet he still manages to survive on top of teaching? Do you people not sleep or something??"
62916,"Some stingy, tight fisted youngsters choose to remain living with their parents in their hdb flats even in their 40s. Refuse to own a car even though they earn more than enough to afford it under the excuse that grab cab is cheap and mrt is accessible. Their main intention is to avoid chauffeuring duty and spend their money on luxury tours 3 or 4 times a year overseas. YOLO spirit is very rife among the youngsters."
62915,"Hi everyone, just wondering, how do people view NUS students dating other students from other schools that are not from the three unis (NTU, NUS, SMU)? Does it really matter?"
62914,"To #62872

I am in a similar position, my family earns less than $2-3k every month and I work every month even during school term to earn some pocket money for myself. I am also graduating this semester and will be going on a grad trip with my friends. 

At first, I was thinking, should I not go overseas and save the money for my family instead? Since, like many in the comment section had said:
1) Family first
2) Family will be there for you more than your friends

However, the friends I'm going with are friends that I've known for a long time, and I know that once everybody start working, have boyfriends, or even will start to plan to have a family, it will be difficult to plan for an overseas trip in the future. I also treat it as a motivation, for me to clear my mind, and to be ready to work hard in my future career, to focus 100% on my family, clear their debts and etc. 

Finances wise, since we planned early, we tried to find the lowest cost flights and airbnb, and during trip planning, we tried to go as budget as possible (e.g. going to an area and touring that area for the day, to save on transport; checking out discount sites like klook, or even going to the tourism board of the country that we are going to to see if they have discount coupons to spare). And set a limit on how much we can spend by changing $x and sticking to that amount on the trip. Even though I'm not going to Japan, I believe that it is possible to enjoy while going on budget as well - take many pictures!

I guess this is also a time to test your friendships? To see if both parties are willing to compromise. If they are willing to give up going to expensive places, or if you are willing to splurge just once/twice as a treat for yourself?

We have never travelled as a family together, but I always make sure to bring back some souvenirs, such as items like shirts and food for my family. And make it a point that when I start working, I need to bring them out. I know I may be called selfish for not putting my family first, but who knows, this time after grad and before work may be the only time that we are really ""free"" and the only time for us to properly relax before stepping into the workforce."
62913,"Hi! I've been trying to apply for a summer internship since the start of April but all my applications have been unsuccessful so far, and I've only received one call back for an interview. They said they would get back to me by next week but it's been 3 weeks so I've pretty much given up hope on getting an answer from them. I know that internships are really important in adding that experience to your portfolio when you look for jobs after you graduate, so im feeling pretty demoralised because I just finished my 2nd year in uni and have never done an internship. If I'm already having such a hard time looking for internships, I fear it'll be even worse in the future when I have to look for a job:/ anyone has any advice for me? Appreciate it!"
62911,"#62871: I feel you, losing weight can be really tough. I went on a long, healthy, and successful weight loss programme and here are some tips.

First of all, some commenters say that 1200kcals will malnourish you and that is not really true. As a girl in your early 20's your basal metabolism is probably around 1200-1300kcals, so keeping it around 1200 is fine. But I wouldn’t suggest calorie counting; a rough idea of how much you’re eating is less stressful. 

What matters more is what you eat. I'm sorry to break it to you but the food you get from coffee shops is not the best for losing weight. Not even the 'healthier' options. Contrary to what the posters say, fish soup or YTF is not really a good option because of the sheer amount of sodium in them. Sodium is worse than carbs because they make you bloated, which makes one look 'fat' too. Also, it’s okay if you eat carbs - if you reduce carbs too much you’ll have crazy cravings. Just opt for the better carbs. Take brown rice instead of white rice and avoid flour - that includes noodles, dumplings, etc. Tbh it’s really hard to get food in Singapore that helps you to lose weight, even the veggies in economic rice are cooked in oil. Don’t get me wrong, the food is quite healthy for people who are trying to maintain their weight, but not for those who are trying to lose weight. 

You can also try to cook during the summer break, have fresh veggies, proteins, and healthier carbs. And try not to eat anything after dinner and drink lots of water (~2L a day).
 
Oh and here’s a tip - you should actually say goodbye to stuff like sweets and fried food (I know, sad), but you should allow yourself to eat a bit once a week or so, to control your cravings. Set a day aside (like Sunday) to eat what you want (in moderation). This helped me a lot. 

If you happen to break down one day and eat supper or something, don’t give up. Eat slightly cleaner the next day and don’t give up. Sometimes you’ll find yourself breaking down for days on end… still, don’t give up. I’ve been there. It will get worse during your period and it will be very difficult to lose weight during that week. But the important thing is to persevere. Weight loss is a repetition of stagnant weight and sudden loss, so sometimes you need to wait a bit until your numbers start going down.

For cardio, running is better than walking. Honestly, brisk walks don’t really help with weight loss, I’ve tried. :( You can run a bit and then walk fast, then run again, and so on. 

Now, weights. So, you see some people who tell you to ‘get a trainer’ or ‘do weights’, right? I agree to half of that. In the long run, yes, you need muscles to get into a better shape. If you keep doing only cardio, you’ll be really skinny but not in a healthy, good-looking way. So in the long run, you need muscles, and you need to do weights to gain muscle mass.

But, here’s the thing. Weight loss is all about the mentality and stress. Especially when your weight is affecting you psychologically. I was in your shoes too. When you’re at the early stages of losing weight, seeing the numbers change is really helpful. So at first, focus on really changing your eating habits and doing cardio, so you start seeing changes in your weight. Also, take photos in the mirror and see those changes yourself. After you’ve lost a few pounds you can start weights. Yes, the initial weight loss is mostly losing some water and a bit of muscle mass. But that does motivate you initially.

Secondly, it’s much harder for girls to gain muscles. You can do squats, lunges, and crunches every single day and not gain a lot of muscle mass. The muscle-gaining process will be a long, long journey. If you start weights too early, you’ll get stressed because you won’t see much weight loss but you don’t see muscles either. It’s all about stress control.

And last but not least - give yourself a lot of time. Weight loss that happens in a short period of time will lead to a quick regain. Give yourself at least a few months and think of it as a process to change your lifestyle and habits! It’s really self-care because you are getting yourself to eat healthier food and adopt healthier habits (like exercise regularly, sleep early, drink more water). It will take some time because losing weight doesn’t have a one-size-fits-all method. You’ll need to take a lot of trial and error to find a way that works for you. All the best!"
62910,"Hi guys, will you attend your commencement even if your parents told you that they are not going? How will you handle the loneliness when everyone else has parents/relatives around?"
62909,"Read an article about millenials, and some who chose to settle down and get married quite young, and there was an anecdote, about this couple who in the midst of a terrible fight found their moment of clarity, the guy stepped back and asked, is this it for us? And she replied, no, i'm willing to keep trying if you are. reading that made me a little wistful. I never want to be that fool holding on to something that never was, but I can't help feeling sad because, I was willing to keep trying, but you only spelled the end. Who am I to ask for something you don't want?

#62909, you're not alone. I hope we each find a love we deserve."
62908,"Is NUS actually considered prestigious in Singapore?
Back in my JC it was never a question of ""could we go to NUS?"" but more of ""do we want to go to NUS?"", so I'm always surprised when people refer to it with awe.
There's no shortage of incompetence here, that's for sure."
62906,"Finals are over, but it is bittersweet. I saw her outside the exam hall again in her octopus shirt, for the last time in a long time. Somehow, life always seems to put me in her vicinity as if to taunt me. I see her in tutorials and around school and on the bus but it's like I'm just...transparent to her."
62905,"#62905 Too bad, he's beyond your reach. Go do some research on his background first."
62904,"Hey #62904, don't worry. Your life isn't that complicated. You said guy A doesn't feel the same way towards you and you don't feel the same towards guy B while guy C is just a fwb. 

Since no one shares mutual feelings with you, it's best to just move on. So yup you should continue talking to other guys and see if there are better ones out there. 

I'm sure you will eventually find someone who feels the same towards you. Honestly I think my life is a little more complicated. 

Some years back I joined two CCAs and got to know two guys from each CCA. During final year, I often went out with each of them. Let's just call them V & W. I liked V first. 

One day I decided to confess to V. He rejected me. He said W likes me and as a good friend of W, he felt that it'd be wrong of him to date me. 

I stopped going out with V but continued to go out with W. W showered me with care. Eventually, I was moved by his effort and decided to date him. 

When V saw that W and I were dating, he got really upset. He suddenly stopped hanging out with W, which left W feeling confused and troubled. 

Seeing that both of them were upset with each other, I decided to end things with W. What surprised me most was V suddenly decided that he wants to date me. I asked him to give me some time to think it through. 

V said he regretted letting go of me. At the same time, W continued asking me out, hoping that I would accept him again. 

To take things off my mind, I started a new hobby and met guy X. X actually knew W from army. They hang out occasionally and he knew about me and W.

I was attracted to X and he liked me too. But I didn't want him to feel like he's a rebound, so I asked to hang out as friends first.

On my graduation day, V and W wanted to come. I persuaded W not to come and let V come because he wanted to help take photos and he's a good photographer. 

X suddenly said he's nearby so he decided to come over. Both wanted to send me home and invited themselves into my house. Three of us sat on the couch and made some small talk. The situation was painfully awkward.

I then started my first job. A few weeks into the job, I met guy Y and guy Z, both from different dept. 

Y would often buy me breakfast and coffee while Z would always offer to help me with my work whenever I face difficulties. I would often hang out with each of them after work. 

Coincidentally, Y's birthday and Z's birthday are 2 days apart. But they wanted to celebrate with me on the same saturday. I went out with Y and left a few hours later for dinner with Z. It was sad seeing the disappointed look in Y as I went off. 

Z then started asking me out for movies and dinners. There was once we were walking around the mall after dinner and ran into V and his female friend. 

I felt a little jealous and casually asked V who she was. I decided to tell him how I feel. He said it was just a long time friend and got jealous that I was with a guy. I told him it was just a colleague. He then asked me to give him another chance. Realising that I still like him, I finally accepted him. I also decided to cut off contact with everyone else. 

Indeed, life can be quite complicated and frustrating. But what is meant to be in our lives will find its way to us. So just be a little patient, things would turn out fine in the end."
