tag,text
62013,"Disclaimer: I'm not condoning the Accused's actions and behaviour. But I believe that the outcome is at the minimum procedurally fair (I leave open the question as to whether it is morally fair).
This post seeks to state that the process was complied with. Perhaps moving forward, the university has the discretion to mandate harsher punishment. (Note that I say moving forward and not for the current case).

Some of you are saying that the police/prosecution was lenient etc etc etc.
But what if I told you that as this is the Accused's first offence, the prosecution/police has the discretion to let the Accused go with a warning?
Now some of you might argue that this is 'unfair'. My counter to this is that the prosecution/police has good reasons to issue the Accused a warning. The prosecution/police not only have the information and evidence, but are also responsible for crime control etc. They came to this decision having taken into account all relevant  considerations.
Now some of you might also argue that prosecutorial discretion is subjected to review as all powers have legal limits. Ramalingam (SGCA 2011) states that prosecutorial discretion is subjected to review where (1) there is an allegation of bad faith; (2) exercise of the discretion contravenes a constitutionally guaranteed right. 
But in my opinion, it is hard to prove that there is bad faith in the current case and I do not see any contravention of a constitutional right.
Now, some of you might argue that that nonetheless the punishment was too lax. But this is not something the police/prosecution can control. Only parliament has the power to change the punishment etc...

Moving on to the jurisdiction of NUS. In my opinion, the courts system is responsible for penal cases and decision and not NUS. I think that the jurisdiction of NUS should and must be separate and that the Board of Discipline should serve the specific purpose of ensuring student discipline. I also think that a student should not be punished twice for the same offence and that in this case, punishment was meted out.
Nonetheless, some of you might argue that the punishment meted out in this case was too lenient. NUS can update its regulation, but case is closed on the current case.
I would also venture to suggest that NUS is rightly concerned about its reputation in the current case. Punishment was meted out to the Accused and thus, the case is closed. Moreover, I would like to suggest that the Victim herself breached confidentiality by coming out in the first place. I may or may not come back to this later.

Now I would like to move on to the decision. I'm only concerned that the procedure was followed and in this case, the procedure was clearly followed. Which means that if anyone wants to complain, they have to allege some form of procedural unfairness. This is a high threshold to meet and I don't think it will work.
Moreover, I doubt that the victim herself can appeal as she does not have locus standi (In the courts, or in the Disciplinary Board)

Concluding thoughts: Res Judicata. 
Also, the whole situation is completed according to the process. Justice was done in the present case (whether you like it or not). I do understand the outroar over this, but please, NUS can only change the rules for future cases and not for the current case. NUS is also doing so by convening a committee to review the rules.
The petition has served its purpose - awareness was raised, and NUS is trying to solve the problem.
(Although I saw a post somewhere which states that NUS' punishment framework is consistent with the other universities both locally and worldwide)

Back to preparing for Finals."
62012,"There are some things here which have surprised me over these days, and I would like or raise several issues and thoughts. The whole issue has indeed shown me the state we as a society are in today.

Let me start off by saying that this post (or I believe any post) does not condone the actions of the perpetrator. What he did was explicitly wrong in any sane mind, or in any universe. 

One thing I do not understand however, is the need to blame NUS for the whole issue. The NUS disciplinary board and the AGC are 2 completely separate bodies. The former is an educational institution while the later holds the right to charge offending parties. Traditionally, when acts of criminal nature are committed, the AGC has the final right to decide what the appropriate punishment should be. This is where the search for criminal justice ends, as the prosecutor has decided whether they wish to pursue the matter further and bring it to court. If you are unhappy with the decision, go to the AGC and the police to revisit the case. The ""victim"" claims that the investigating officer (IO) told her to seek ""harsher punishment"" from the school. If this is true, the IO also made a mistake here as NUS simply does not have the authority to exert criminal justice.

NUS is an educational institution. Its rule and punishments primarily revolve around academia and protecting its academic integrity. We are no longer in primary school, where talking back to a teacher warrants public caning. Decide to plagiarise other's research or falsify your data? Then yes, NUS might expel you. Why is it like this? Its because the AGC and NUS disciplinary board serve 2 different functions. The NUS disciplinary body is not and should not be a replacement for the criminal justice system.

And please guys, we're all in university.  I thought that it was finally a place where we could have nice discussions on how to improve the system, listen to nicely phrased arguments without emotion taking a centrestage all our arguments. However, what we're seeing here are comments we can also see in the Straits Times comment sections. Rational arguments are now considered to be the politically incorrect thing to do, and hence do not appear much. This is because any viewpoint (just like in the ST comments) with a slight deviation from the norm would be met with responses like ""if its your mother or sister..."". This slightly intrigues me as it seems to blame the opinion for being wrong per se, instead of trying to have a reasonable discussion like young adults. There is a clear difference in the way some of you phrase your arguments, and well the quality of discussion in other faculties.

Last thing, y'all are a painful reminder of why online vigilantism should never be condoned. 
Don't like the punishment? Please go to the relevant authorities. To those of you harassing the guy involved, don't give us the shit that ""if he didn't want to be harassed, don't do it in the first place"". You have dragged innocent parties into the mix as collaterals, and that is simply unfair to them. To paint a mental analogy in your mind, you're like a big-sized Batman speaking Singlish.

Im sure I'll get a lot of flack for holding a view which is not the same as yours. I phrased this with the mindset that I would be talking to a bunch of Straits Times commenters, but I do hope you all will forgive me if a small detail of my argument does not agree with yours.

"
62010,"Been hearing this 'Chinese male privilege' being thrown around recently due to the saga.

Come on guys, one horny boi with a 'powerful' background does not a trend make 

The only 'chinese Male privilege' I know is NS . ????
But then again it isn't really limited to just chinese  males"
62009,"To the exchange student who asked me where i bought my shorts at PGPR Foyer yesterday, i wished i have the guts to ask you for your number"
62004,"Don’t get why ppl hating on Monica so much when it’s the police that taichi her to NUS, then now ppl wanna taichi her back to SPF & AGC. She just following what the SPF tell her to do what ????

She deem the punishment is light or whatever, she just pursuing what she deem is right now why y’all hating on her? If you look at it, she did the chill way first of waiting for the emails from Nus to see if they will punish him more, before blowing it up big on social media. 

The guy did a crime, should prepare to do the time also what. 20+ years old already, don’t know taking taking videos of ppl bathing crime meh. How he make it to Uni like that aiyo????????‍♂️

Excuse my singlish I lazy  "
