tag,text
65124,"Is UTown Fine Food supposed to pack up and stop selling at 9pm? Tried to buy from Chinese food, Bak Chor Mee stall and Western around 8.50pm and they all told me the same thing, that they already packed up and not selling anymore. Legit asking out of curiosity, pls don’t flame me."
65123,"I already know that I like people of the same gender, but its not 100% certain yet. Should I just force myself to get into a relationship with someone opposite gender just to prove a point, just like what everyone around me is asking me to? Is it worth all the agony and stress"
65120,"The recent posts about relationships and whether one should break up because of xxx reasons make me feel that there is something wrong with the society today. Guys/girls, if you have an issue with your significant other, you should communicate that to him/her. The point of a relationship is open communication right? If you can't even communicate your concerns to him/her at the early stages of a relationship how are you guys going to last in the future... No relationship is perfect at the start and a strong relationship is built on open communication and understanding. 
Peace out ✌"
65117,"Lmao 65112 people look at me and instantly can tell I'm single. 

You're just good looking or keeper material la. On the other hand, I'm a 3/10 guy so it's obvious"
65116,"Hello, I recently called off my wedding with my ex fiancé due to some arguments. Was told by some of my friends about a post circulating on NUSWhispers which bears high resemblance to my situation. I believe the OP of #64974 and #65116 is my ex fiancé. I just want to share my side of the story.

Yes, it’s true that my ex fiancé got a pay rise recently and that ended up with her pay being higher than mine. But what happened was after her pay rise, I saw a side of her that I never noticed before. She became arrogant, controlling, and bossy. She acted like a know it all. She treated me as if I was a beggar who needed her to feed me. When we’re out with our friends, she acted as if she was the boss and I was her subordinate. When you’re treated like her subordinate when in reality you’re not, how can you not lose face?

Now that I’ve seen her post on NUSWhispers, i can be even more certain that I made the right decision to call off the wedding. I saw one of her posts which called me childish. Well let me say she is the real childish one. Why is she so childish that she has to go onto such an anonymous forum to rant, instead of communicating directly with me? If my future wife is this type of person who will stab me the back and complain about everything we disagree on by ranting anonymously online, then of course I would call off the wedding!

If anyone wants to say that I’ve drooped to as low as her by posting this post anonymously online, let me say to them this: I myself am only commenting here because I want to give everyone here the other side of the story. And also to warn others against falling into the situation that I’m in now.  To those guys out there, these type of women are toxic. If you ever come across this type of women, LEAVE HER AT ALL COSTS."
65114,"My girlfriend has a super high sex drive, she would ask for it everyday if she could. Should I be worried? Not that I am complaining but when I tell my friends about it, they say that she is just in it for the sex but it doesn’t feel that way as she can be super caring about me and treats me genuinely. Just a bit wild in bed..."
65112,"Why would people of both genders always assume that I'm attatched. I just don't geddit. It happens so many times over the past 2 years that I get triggered by their surprise face whenever I say, ""nope, I'm single"" now. And they will be like ""don't lie"". Like seriously, there is nothing to lie about this right. I have better things to do boi. Damn tired of justifying that I'm single already. Like just stop seriously....."
65109,"hi my girlfriend really likes hello kitty and she always dresses up as hello kitty and expects me to treat her like an actual cat, pet her, dress her up, take her on walks, feed her from a cat bowl. I don't know how to tell her that this is not normal behavior without hurting her feelings. But most importantly, Hello Kitty isn't even a cat. How should I break the news to her?"
65107,"How does one get started going to the gym? I'm a pudgy overweight girl and I would like to change that. I've always been the social outcast type, don't have many friends, go to lectures and tutorials alone etc. Started working for a year and my life is just work, sleep, eat, netflix. Because I rarely go out of the house except for work, I put on more weight. I've never been good at sports and always failed my napfa test in school. I live near an anytime fitness gym but feel intimidated by the fit guys and girls that go there. I dont even dare to walk in because im scared that people will judge me like what is this fat girl doing here... Any tips on how i can get started and will it be costly to get a personal trainer or should i just start myself? I don't have close friends, just casual aquaintances so I dont know who to ask."
65106,"Will you break up with your boyfriend/partner if they don't initiate texts? I have to initiate texts most of the time, send him goodnight/good morning texts while he never initiates them. And because he doesn't, I've stopped doing so as well. Whenever I share about something, he also takes ages to reply to one text (about 5 or 6hrs) and by the time he does, the excitement/mood has already fizzled. He doesn't take the initiative to even text me in his free time after work and his work isn't even that busy. I feel as if he doesn't even care what I'm up to. Oh and he wasn't like this when we just got together, he was quite responsive and would send me interesting news and stuff after work."
65104,"I'm the OP of #65057.

My sister still doesn't know that I've found out. I'm a female by the way. Thank you to those who have provided constructive advice. For your information, that teacher is still currently a teacher in a local secondary school and it seems like he's being promoted or will be working in another school soon. This teacher is also the 'cool' type of teacher that got along really well with most students, he's supposedly a really nice teacher but I guess deep down he's not. And yes, I used the term high school because I didn't want to appear too obvious in case my sister somehow chance upon this post. 

So now it's either I reach out to the teacher and ask him to stop this or I'll have to talk to my sister. 
If I talk to my sister about this and she doesn't listen/understand, it might ruin our sister relationship for life which I really don't want. I believe this has been going on for years (according to their convo and how they continued to keep in touch since sec school till now uni.) It seems like she's really in love with him and I'm worried that she might be too deep in this for her to understand what's right and wrong anymore. 

One of the comments also said that she's of legal age now so it's not legally wrong but it's just morally wrong and I'm worried about what might happen in the long term. This teacher is definitely wrong and sick in getting involved with a (ex) student and doing such things behind his wife and kids' back. It's just disgusting. 

Pls tell me what I should do. Or what should I tell her in order for her to realize that she needs to get out of this."
65103,"I always feel secretly happy when people around me fail. For instance, I felt glad when a friend unexpectedly got a much lower grade than me and another friend broke off with his girlfriend. Also when I read about some ex-millionaire made bankrupt or celebrity scandal. Am I normal?"
65102,Hello #65041. In the 21st century gender equality means equality in terms of privacy for men too. What a one sided thought you have when you recommend that the womens toilet should have more floor space allocated. As a guy who use the cubicle to pee I prefer my privacy and dignity. Well if you want speed then you might as well invent a urinal for women to pee in a similar open fashion. I dont think you will agree to that. Likewise I dont agree on more urinal than cubicles in the gents.
65100,To #65066: i can totally understand where your female friend is coming from as its one of my girlfriend dream to be naked when she is living alone cos she can feel free too. Dont judge them. I find it rather cute actually. There was once i even went up to her house for out 1st anniversary and caught her scurrying back to her room as she was only wearing a t shirt with only an underwear (since there was a maid at home so she didnt go totally naked).
