tag,text
61842,"This is the admin of #61703 replying to Mr. BTech who is ""not replying indefinitely"".

If you still do not see the point that I am putting across, assuming that I am a ""emotional teenager"", perhaps your inability to comprehend my argument is the exact reason you spur us on by saying ""grades are not important"".

Old man, our studies do not simply comprise of ""regurgitat(ing) knowledge"". Granted, everybody knows the knowledge you learn in school, regardless of level might not be used for your future job or even tertiary education. The chemistry knowledge I learnt in JC definitely isn't fully applicable to the course I'm studying now. What the education system does succeed in however, is fulfilling the purpose of nurturing critical thinkers. The questions I tacked in A Levels set the foundations on how I should study, problems which come out of it and how I should solve it. Just like in uni, where a firm grasp of knowledge on my major would be a good indication that I can critically think in the field and perhaps contribute to the firm I join. 

More importantly, thank you to #61802 for your insight on the topic. I guess it does take a real life example to show people the reality of the situation, and I wish you all the best in your future career. Bottom line, grades do matter for most jobs as the first point of selection. What comes next (e.g. attitude and ability to work in a firm) will be judged AFTER grades were looked at. Typically, the people who say ""grades don't matter"" either really don't need them cos they are secure in their future, or are just trying to throw you off to study less for the bell curve.

A lot of you have commented (esp the guy who said something along the lines of it depends on what you do). I do acknowledge your point, and I did think about it. You are right by saying that everybody has different aspirations. After all, we cannot have a society full of doctors, just like how we cannot have one full of poets. But that brings me to the point I brought up in my original post. However, what mommy told me at the end of the day makes perfect sense; ""it doesn't matter how well you do, as long as you tried your best"". I admit that maybe me and the other guy might have made results sound like a means to an end. Thats not true, we are just saying that the notion of grades not being important is utter rubbish. At the end of the day however, there will always be people who do better than others. To the people who aren't doing well, as long as they have done their best, thats all that matters. To tell them however, that grades aren't important before they have even tried could lull them into a false sense of insecurity. Instead, EVEN IF WE KNOW that they are not at the top of their class, we should still encourage them to work hard, and the end product does not matter as long as they tried their best.

It might seem confusing but let me summarise my argument. 
(1) Grades do matter, I'm sorry but this reality will be here for a long time. 
(2) Grades are not means to an end. TRY YOUR BEST in whatever you do, thats what is important. If your aim is to be a world-class farmer, take a course related to it (hypothetically), and WORK HARD AT IT.


"
61841,"To #61765: Senior here from Electrical Engineering. I managed to go for exchange to my first-choice uni with a D and a C+ :) I think a single grade is unlikely to be a deal-breaker, what matters more is the overall strength of your application, e.g. are you likely to: 
- Represent NUS in a good light? 
- Be a good fit for the university/programme you chose? (Is there anything that makes it particularly suitable for you?)
- Appreciate and make the most of your opportunity? (E.g. participate in school/activities, immerse in the culture, make meaningful connections)
- Cope well academically and socially, and graduate on time when back? 

I think you do stand a good chance if you can communicate some of these points in your application. Hope you get in, exchange is a fantastic opportunity :) Good luck! "
61839,"I’m an introvert. I neither like making friends nor enemies. I have a super uncomplicated, drama free life. I like staying in my room and enjoy solitude. It’s not like I don’t enjoy being around friends. I do have a few good friends. But I don’t take the initiative to expand my *network*. Ppl have often told me to be more open. I understand.
Sometimes I feel ppl around me want me to be more outspoken.  I tried and I failed.  Always wondered if staying true to myself and not forcing myself to be more outgoing a good thing? 
Ahhh how should I deal with this :( "
61838,"I know that she is merely being friendly to me. I am not even capable of being considered a friend to her. Everything is just a wishful thinking of my part.

However, the relationship mirage feels real. Every time I chat with her, the feeling of loneliness disappear. Every night before I sleep, I dream of us hanging out as couple

One day, she just decided to stop chatting with me. It hurts just as much as a real breakup, except that it is hard for people understand the pain as it was merely a relationship mirage."
61837,"#61837 Personally think that sometimes, we really do see people like that. I'm guessing this is the kind of thing the poster of that story was going on about ""Chinese Male Privilege""... I understand defending your friends/coursemates/peers, but not like this, man.

The last thing we want to do is make light of this."
61836,"Strongly agree with #61777.

In my honest opinion, in this particular case yes the victim wants justice which is right and proper, but what she feels most sad from what I've been reading seems to be her disappointment and anger that this has happened on more than a few occasions, and in I'm understanding her correctly what she wants most is for the same thing never to happen to anyone else again. Rather than for everyone else to play judge, I think the victim reiterates very clearly that she wants there to be compulsory re-education or community service, which is something within the powers of the school. Again, prison sentences are not within the power of the school nor the police but the courts, and it would be crazy to bring corporal punishment into the university setting.

The suspension by itself unfortunately doesn't go any way to ensuring that there is going to be any change in the mindset and behaviour. It's like going to a 'some sort of therapy centre' (see Youtube and you'll see what I'm talking about), and saying ""It's OK, I'm dealing with this myself, no need for the police."" For some, yes a suspension is good enough for them to reflect on their actions, sincerely make up to the victim and never do it again. But for others who are more stubborn, this will not work. Something more helpful in changing all offenders and be of better use to the victims would be to institute community service & compulsory re-education during that suspension, and with someone (whether it's a counsellor or etc) to track the offender's progress for a full semester to see if the offender is ready to earn his second chance. Random phone spot checks for the offender (again this might be a privacy concern to some but I think at least for the period of his suspension it seems fair) or instituting a curfew for the period of the suspension if it's easier to strike at night.

On the other hand, I've been for rehabilitative measures where possible because I think what brings closure to the victim is that this shit doesn't happen again. You can jail the offender but if he ends up being that 25% of inmates who reoffend despite going through such a harsh punishment what you end up with is a hardened criminal, who may do even worse things in future. Our society still has some way to go in reintegrating former criminals after they complete their sentence, which is why we need to be cautious when we call for jail sentences because 1 in 4 will reoffend. Being tough on crime is one thing, but being tough on the causes of crime is another. You need both to nip the problem in the bud."
61831,"#61793: Can just post it if it is true. so far, i have not heard of any guys suing for defamation when they are a perpetrator of sex crime. they will threaten and hope the victim dont take any action. this is just legal intimidation.  empty threats. 

they definitely wont sue. reason that they will not sue is because: 
1. they did it. 
2. so when it comes to legal proceeding they are at a loss, it cast a very negative light on them. and the whole world will know they did it
3. after losing the civil suit of defamation, they will still face criminal proceedings

they would rather threaten and hope you are intimidated, and dont even report to police.

whatever happens, just report to police and post on social media to warn other potential victims. 

today it is you, tmr it could be someone else. zero tolerance to sex crimes. do not be scared. even if you receive a legal letter, seek counsel, and post.



"
61829,"#61829 #53084 

Oh no, it sounds like I was approached by this guy too. I know it's him because he meows and he's a maths grad student. I just saw this on NUSWhispers by chance, and before this I didn't know that other people had similar experiences. I don't think I was harassed enough to make a case, but I hope sharing will help others stay safe and know that they're not alone. 

I first encountered him in April 2017 in Utown. I don't wanna reveal details that will let him know it's me, but I remember a few odd things about that first meeting: 

- He kept pestering me for my number or other contact, saying ""otherwise how would I meet you again?"" Over the next few weeks I got messages from him asking to meet up, but I just kept saying no.
- The conversation got a bit too close for comfort very quickly. He kept saying I'm chio, I'm special, I'm just like his fiancee etc. And ""I was just like you when I was your age""
- He knew I was attached, but still wanted to meet up for ""study dates"" and said I don't have to tell my boyfriend. I got super uncomfortable
- He asked if I was a virgin, twice
- He just seemed very preoccupied with getting an undergrad girlfriend. He was upfront about going around the university to look for girls, and asked me to refer him to single girls if I know any
- He talked about how he objectifies girls and ranks them by their attributes. When I brought up how it's uncomfortable for a girl to feel objectified, he said he saw no problem with it

In the end, after enough pestering I got pissed off and just told him firmly, no means no, I'm not responding to any more messages. It was freaky enough that I avoided Utown for about a year. 

Reading the confessions here, I guess I'm lucky I got away safely. Thanks to everyone who shared, you helped me realise it wasn't just me, and hopefully it helps other girls in NUS too. "
61827,"I notice that if you google past cases of molestation or peeping, you actually dont hear what the universities do to their students (you hear the criminal charges but not exactly sure if the students were expelled or anything) 

I only looked at cases from ntu, nus and a surprising lack from smu (awaiting the results of the investigation of the smu one). 

Polytechnics also seem to have slightly different standards from University, is it just me or does the top results on google almost imply that most offenders in polytechnics go to jail rather than the 12 month warning period? (University students SEEM to enjoy this benefit)"
61826,"I need some advice. My boyfriend recently asked me to take better care of myself. I´m pretty relaxed about my looks, wear makeup from time to time. He started behaving weirdly and I pressured him to tell me why and  he told me he has trouble finding me attractive when he sees I am not putting any effort into how I look (which is not completely true). Is this a serious issue? I haven´t changed anything since we started our relationship, why did he start minding it now? I´ve always been like this. Should I break up with him or am I just over reacting? "
61824,Where does one look for a CTO in NUS to startup a company?
61823,It seems like most of the PCs in PC Commons are not functioning. Very frustrated as I've already spoken to tech support over this and they ask for an ID for every computer. But there must be about 15 computers here that don't work. Hopefully someone from NUS will see this and can sort it
61821,hello! asking if there is anyone heading to aarhus for summer school? :)
61819,"I like how the victim's name appeared big big on NUS official statement but the culprit is deemed as a ""the male student"". Can like that one meh? Even gagged order in news is censored the victim's name ma."
61817,"I'm a fan of fair punishment dealt to the perpetrator. I'm not a fan of over-punishing the perpetrator. What's happening is the latter. And scheming to get him punished the way you want is not right.

I feel that the true motive of the victim is clear - She wants cold hard revenge and ""fixing the NUS system"" is just a disguise to boost her campaign and garner support for her case against the perpetrator.

Besides, I greatly doubt that NUS would consider any options she is proposing now, given that she did not first seek recourse from higher authorities in NUS, with people that have the power to make decisions, before seeking media coverage. After all, why would they consider her proposals? She knew very well what she was doing would tarnish the school's reputation.

It's like returning a punch in the face to NUS for mishandling the situation and now dictating what NUS should do lol. Does not sound logical to me.

This is just my opinion.
"
61811,Hi I am a computer science student planning to minor in Statistics. Any ST32xx modules to recommend that would complement CS? Thank you!!
61809,"I think paradoxically NUS historical indirect condonance of voyeurism by offering lax punishment caused the current public out-lash. Voyeurism has been a feature of halls of residences. It is high time we do something about it. 

But wondering from PR point of view, is there anything that the perpetrator could have done to avoid the current PR disaster?
Perhaps when NUS offered 1 sem suspension, he could have voluntarily increased to two semesters suspension (without option of internship), and offer a non derisive compensation to the victim? 

 "
61805,"Recently, I found out that my gf (with me for 2 years) told me that she lost her virginity to a jc teacher when she was J1. I believe its because of the recent saga of toilet filming and other happenings that led her to tell me. At that time, she had no clue what sex was at that point in time and was hoaxed to go to his house (which was near hers) for ""tuition"" on multiple occasions. In fact, that teacher was married at that point in time and their relationship lasted for 6 months. I was enraged. How is it possible that she is so gullible and our school teachers acting like monsters preying on students. She also often spoke highly of that ""teacher"" which I felt terribly disgusted about. I wanted to probe further about the details and ask her to make a police report. But I am also afraid that I might upset her in the process. What should I do?"
61803,"To the poster of #61769: We figured it out after the first time you did it... you only think you're scoring the best within the clique because we all unanimously decided to troll you and tell you our supposed grades over the past 3 years. 
Fun fact: Ever wondered why you got the lowest marks for this sem's group project despite working so hard?

Karma's a bitch"
61802,"REPLY TO #61802: 

I was quietly watching this page and this reply to mrbtech is actually the MOST SALTY reply to this whole shenanigan. I cannot take it, must reply back to all university students and to this individual.

Eh dude, firstly I'm sorry you had such a bad experience. You ought to blame yourself for being academically bad. Your failure becomes the world's fault now, for INFLUENCING YOU. 20 over years old and in a university and now you cannot decide what is right or wrong. Still want to be hired in a good company earning good pay?

Seriously who the hell cares about you scoring the best marks in JC and all your ridiculous competitions, volunteers and representation achievements when you scored a 2.88 despite all these. It only shows that you CHOOSE to participate in all the random activities but REFUSE to put in effort in your academics. Since when joining a company don't need to have good results? Besides lousy results, you want to showcase your awesome CCA achievements. Your awesome CCA achievements cannot even justify your technical ability lor. 

You think leadership comes without knowledge one ah? 2.88 want to be a manager earning 4.5k? Wait long long lor please, this is sinkapore. You want to earn 4.5k? Be a sales engineer and chiong lor. This field you need to chiong and hustle to earn the big bucks since you don't have the knowledge.

Sorry lor you don't have the white horse life where you can kiao ka and enjoy in the family business. Then all the worst you have to work hard right?

Eh please la the bunch of you really writing out of context to shame that OP. You want good pay good life then you study hard and be good in your studies first. If you score badly, you will definitely be filtered out. But once you enter the workplace it is a whole new ball game.

ISN'T THIS WHAT THE OP WAS TRYING TO ADDRESS? GOSH! 

Admin: Please don't filter this. You have a bunch of students here who refuse to accept the harsh truth and some more they like to selectively read and rage then negatively portraying the giss of the argument all along. Disagreeing to agree.  "
61801,"Just wondering, what would be the recommended punishment for voyeurism? 

Note that there's a distinction between punishment as a violation of criminal law,  and actions you want the university to take. "
