tag,text
61899,"The fact that there are STILL people supporting the culprit of the recent sexual harassment saga is appalling. He deserves everything that has happened, given how the school and spf haven’t rly punished him enough. If you were the victim, you will know how sad it is when people start showing concern for the culprit rather than you, even though you were not the one to start the whole incident . "
61898,"""For those not up to date. A circular was sent out:

DEAN OF STUDENTS’ CIRCULAR – SEXUAL MISCONDUCT 
 
I want to begin with this unequivocal message – the University does not tolerate sexual misconduct in any form. We believe that every case of sexual misconduct must be investigated, and offenders must be disciplined. We are fully committed to strengthening and expanding the infrastructure, policies and procedures to investigate cases of sexual misconduct and to take strong disciplinary action.  
 
Our focus must always be to further educate students, faculty and staff about respect, consent, bystander intervention, and the support available to survivors of sexual misconduct.
 
We are sorry for the distressing experience cited recently by one of our students, which is of extreme concern to us. We have reached out to her to offer our support and assistance.
 
The offence committed was serious and has been investigated by the Police, who gave the male student a 12-month conditional warning.
 
When such offences are committed, the NUS Board of Discipline, which comprises student and faculty representatives, also conducts its own disciplinary proceedings.
 
It will consider factors such as the severity of the offence, the need for justice for the victim, the rehabilitative needs of the student offender, the safety of the NUS community, and also the decisions and penalties imposed by the authorities.
 
Our disciplinary sanctions, which are not a substitute for criminal proceedings, can include immediate suspension and expulsion, and/or an official reprimand, with the record of offences and sanctions documented in the student’s formal educational records.  The offences and penalties are made available online to all students to view at the end of each semester. You may view this on the NUS Student Portal.
 
We hear your concerns about having a safer and more supportive campus environment.
 
NUS President Professor Tan Eng Chye will convene a committee to review the current student disciplinary and support frameworks. This committee, which will have representation from the NUS Board of Trustees, will study the approaches taken by other international institutions, and solicit views from you, your parents and other stakeholders. The review is intended to tighten the penalty system for offences that affect the safety of our campuses. We will share the findings of this study and follow up actions with you in the new academic year. 
 
There will be two student representatives on this committee – we invite interested students to send their names and contact details to osasec@nus.edu.sg by 28 Apr 19.
 
We urge you to immediately report all instances of sexual misconduct, which will be escalated to trained colleagues at the Office of Campus Security (OCS) for investigation. We have also put in place special investigation and disciplinary procedures to manage suspected cases of sexual misconduct to ensure confidentiality, timeliness and survivor care.
The 24-hour OCS hotline is +65 6874 1616. They can also be reached on email at ocssec@nus.edu.sg. 
 
We will do everything we can to ensure that you are safe and supported during your time with us.""

TLDR: Email osasec@nus.edu.sg to sign up and have the chance to give your input. I myself am graduating so I may not be able to meet their requirements but we need people to step up.
"
61895,"not sure if everyone else understands fully, but it would be great to get some clarification. if both the perp and victim are NUS students, how would a case usually go? 

1. Victim reports to NUS only: does the police get involved at all? from what's being said, seems like NUS encourages victims not to report to the police, and to leave it to the NUS disciplinary board.

2. Victim reports to police only: does the police inform/communicate with the school? 

3. Victim reports to both NUS and the police: do both organisations mete out separate punishments, and do they take each other's punishments into consideration? from the recent case, it appears that the police worked with the school to mete out the punishment, and the police almost defers to NUS. 

given the current NUS stance, it appears that it would be better for a victim to go to the police directly and bypass the school."
61892,"#61829 #53084 

Oh no, it sounds like I was approached by this guy too. I know it's him because he meows and he's a maths grad student. I just saw this on NUSWhispers by chance, and before this I didn't know that other people had similar experiences. I don't think I was harassed enough to make a case, but I hope sharing will help others stay safe and know that they're not alone. 

I first encountered him in April 2017 in Utown. I don't wanna reveal details that will let him know it's me, but I remember a few odd things about that first meeting: 

- He kept pestering me for my number or other contact, saying ""otherwise how would I meet you again?"" Over the next few weeks I got messages from him asking to meet up, but I just kept saying no.
- The conversation got a bit too close for comfort very quickly. He kept saying I'm chio, I'm special, I'm just like his fiancee etc. And ""I was just like you when I was your age""
- He knew I was attached, but still wanted to meet up for ""study dates"" and said I don't have to tell my boyfriend. I got super uncomfortable
- He asked if I was a virgin, twice
- He just seemed very preoccupied with getting an undergrad girlfriend. He was upfront about going around the university to look for girls, and asked me to refer him to single girls if I know any
- He talked about how he objectifies girls and ranks them by their attributes. When I brought up how it's uncomfortable for a girl to feel objectified, he said he saw no problem with it

In the end, after enough pestering I got pissed off and just told him firmly, no means no, I'm not responding to any more messages. It was freaky enough that I avoided Utown for about a year. 

Reading the confessions here, I guess I'm lucky I got away safely. Thanks to everyone who shared, you helped me realise it wasn't just me, and hopefully it helps other girls in NUS too. "
61889,"OP of #61889 here. Just want to say thanks to the guy who commented on my post, Jonathan Choi. I’m only able to do 10% of what you said cos I really really suck at talking to girls. But it worked! Got myself a date for Endgame after exams! Thanks man! "
61887,Would like to know if it is possible to register for modules in special term while still marked as 'Exchange' in the system(supposedly). Intention is to do Special Term Part 2 immediately after the end of exchange.
61882,"The judicial system was put into place so that we as a community do not have to experience injustice. And without a doubt the school should have given a punishment that matches the crime. Okay we all know that. 

So what I really want to talk about is about humanity. You are right that he deserves a harsher punishment, you are right that he should be condemned by us all, but in a world where we are so caught up with being right, sometimes we might have forgotten to be kind. It will not pain me to see him getting his deserved punishment, and this is not about him or them but about us as a community. It really makes me very heartbroken to see us becoming so merciless. 

I know everyone feels the injustice and that’s good, but I feel that only when we are put into a difficult position like this, in a position of strength to determine someone’s fate, then it truly becomes a test of character. 

I really hope that in general, disregarding this incident, we can become a kinder society.  "
61880,"I am starting to get a little anxious as I have not receive a offer into FASS for the new AY. Looking at the IGP released, i assumed that my GPA as a polytechnic student will be able to secure me a place easily. Is admission into FASS that competitive? Is the IGP accurate since it stated for the whole of Social Science and not for each major?"
61879,"Hi, I’m going to be matriculating as a freshmen this coming August in the Chem Eng Program. With the recent news, I’m really worried that I’ll one day end up stressed and go around filming in toilets. I have also read on NUSWhispers other chem eng students are making headlines for the wrong things. For a course that used to be AAA/A, it seems like it’s not so prestigious and random tom harry and unethical dicks can be admitted. Should I request to change course? I feel that it would be quite embarrassing if I told someone I was a chemical engineering grad from NUS."
61878,"I have always relied a lot on external validation. In the past my mood will swing according to whether I score well for exams or not, whether boys in school like me or not. And when I experienced a breakup, the feeling is terrible. I also tend to compare with people around me to see if i am “better than them” in terms of grades, salary, their social life, if they are attached, if I am prettier than them. If i am I will be happy, if I am not I will be devastated. Because of my severe need of external validation, my mood tends to fluctuate from super happy to super sad in a short time or vice versa. Why am I like this?"
61877,"In regard to #61877 (the OP who said she just wants a simple life after studying for many years and completing uni);

Not sure if anyone is in the same position. I'm female and my family background is quite humble so I grew up with a lot of unfulfilled wants. As a result, I am very fearful about not having enough money and became quite career-oriented. I often go the extra mile at my job, but I'm under constant fear about under-performing over every little hiccup. 

I don't enjoy my life because everyday I'm thinking of what my bosses think of me today, what I can do to get the next increment or promotion. It's unhealthy and I don't want to just sprint through these 10 years to wake up at 35 with grey hair (I'm a woman, so that's not cool :'( )and realise that my best years are already behind me. 

Furthermore, my SO is a very kind man who likes kids but I am so fearful of the future (what if I can't give my kid ""enough""? will they have to choose between being kind but mediocre, vs being competitive but successful? will they have to work even harder than me to attain my current standard of living? can I support them while also saving for my retirement?) that I can't see myself as a mum while my other friends look ready to pop one within the next 2 years. My SO jokingly says that my brain is 'damaged' because I grew up poor and financially insecure.

Is there anyone who felt the same as me in middle/late 20s but eventually got through this period? How did it happen? "
61873,Hi I am writing with strong disappointment regards to the email this morning sent by NUSSU regards to the sexual harassment case. How can you publicly state the name of the victim? This behaviour is strongly unacceptable not only from a students view but as a Human Being! You have absolutely no sense of what is privacy! Moreover you mentioned that victims are encouraged to report to NUS. For what? For you to tell the whole world the victim has been harassed sexually?
61869,"I agree that more support can and should be given to the victim. But to everyone saying NUS should take a 'stronger stance', what stronger stance is it supposed to take? NUS should not be the arbiter or ANY criminal offense. Expulsion? Do you all think criminals should be stripped of their right to education? Society shouldn’t be allowed to go around taking away people’s education for their sins. That’s just ensuring that these people become a burden to society for the remainder of their lives. "
61866,Im a non-cs student and I am interested in developing a video game engine from scratch. Do you think its possible any NUS student done this feat before? How was your experience?
61865,"Is nus library portal for exam papers down for anyone else? I'm unable to search for any exam ppers >:( 
what a time"
61863,"I think not just the computers at PC commons are not working but also the ones in MAC commons. On a side note, can those people who are studying at PC commons please be considerate and dont leave your belongings there for like more than 1 hour? Referring to a specific group of people :)"
61861,"OK neutral party here on the Monica baey thing. I get that Nus should convene and that she is just voicing out. But does anyone else here feels that she's getting a bit too happy over the whole incident and maybe there's something more than just change and justice that she wants? I mean come on, with stuff like ""mom, I'm on the news"". I don't feel it's anything to be proud of and if anything, this is borderline milking the whole saga for fame. "
61860,"While I applaud her courage to press for change, I personally feel that she presented a very biased view of how NUS handled the case, and that she may be too irrational now. If you have been following the details closely, NUS has actually punished the boy more than sufficiently by suspending him for 1 sem, giving him an official letter of reprimand, making him go for counselling and rehab and do 30 hours of corrective work. The incident had also been reported to the police, but there was probably insufficient evidence to jail him. This shows that NUS has already done its part, so please stop blaming the school. I agree that more can be done to help victims, but I strongly urge all of you to read up what happened in detail instead of expressing your anger on the school irrationally based on what you see on your friends' instagram stories. "
61859,"in light of the recent incident about sexual harassment and statements put out by various parties, including NUSSU, i was very puzzled by point 6 as written by them. Reproduced here: 

""6.	NUSSU Exco also recognises, that as opposed to a criminal court, that rehabilitation is an extremely strong principle in how student offenders are treated in the Board of Discipline, given that NUS is an educational institution. NUSSU Exco also notes that the Board of Discipline had acted in accordance with existing precedent and due process, and respects that the decision by the Board was arrived at in good faith.""

This left me with a lot of confusion about how things are handled as per the school's regulations. As a result, I came up with this table to help myself understand potential combinations of titles and location of such an act. I'm not a law student and neither am I trained legally in any way, so I was hoping if anyone here could help me out and fill in the blanks?

I just want to seriously understand this matter. Thank you.

"
61856,"REPLY TO #61802: 

I was quietly watching this page and this reply to mrbtech is actually the MOST SALTY reply to this whole shenanigan. I cannot take it, must reply back to all university students and to this individual.

Eh dude, firstly I'm sorry you had such a bad experience. You ought to blame yourself for being academically bad. Your failure becomes the world's fault now, for INFLUENCING YOU. 20 over years old and in a university and now you cannot decide what is right or wrong. Still want to be hired in a good company earning good pay?

Seriously who the hell cares about you scoring the best marks in JC and all your ridiculous competitions, volunteers and representation achievements when you scored a 2.88 despite all these. It only shows that you CHOOSE to participate in all the random activities but REFUSE to put in effort in your academics. Since when joining a company don't need to have good results? Besides lousy results, you want to showcase your awesome CCA achievements. Your awesome CCA achievements cannot even justify your technical ability lor. 

You think leadership comes without knowledge one ah? 2.88 want to be a manager earning 4.5k? Wait long long lor please, this is sinkapore. You want to earn 4.5k? Be a sales engineer and chiong lor. This field you need to chiong and hustle to earn the big bucks since you don't have the knowledge.

Sorry lor you don't have the white horse life where you can kiao ka and enjoy in the family business. Then all the worst you have to work hard right?

Eh please la the bunch of you really writing out of context to shame that OP. You want good pay good life then you study hard and be good in your studies first. If you score badly, you will definitely be filtered out. But once you enter the workplace it is a whole new ball game.

ISN'T THIS WHAT THE OP WAS TRYING TO ADDRESS? GOSH! 

Admin: Please don't filter this. You have a bunch of students here who refuse to accept the harsh truth and some more they like to selectively read and rage then negatively portraying the giss of the argument all along. Disagreeing to agree.  "
61855,"Noticed that netizens are upset with NUS’s handling of the recent Nicholas Lim/Monica Baey saga. But why ain’t people angry at how the police handled it too? Shouldn’t the police also be made to clarify their stance? I’m sure there are a few news report of people committing similar crimes and actually have been given an actual criminal record, with legit punishment). In this case, the police only gave him a conditional warning, which basically means nothing. And this is when there are evidences of him filming a naked lady showering?!

I have been a victim of upskirt photo/video before. I only had a few hours of sleep before the incident and hence I led my guard down; it didn’t come across to me that it doesn’t quite make sense for somebody to stand close behind me on an escalator during off-peak hours. I was maybe 15 seconds late in sensing something was wrong and when I looked behind me, the prepetrator have already been using his phone on me. FYI my dress length was below my knee so don’t victim-blame me. I confronted him while we were still on the escalator and proceeded to singlehandedly nab him after he denied my accusation yet refused to let me check his phone, which was in camera mode and he gave ran. There was CCTVs around that filmed the whole incident, multiple witnesses of the public and police when they saw me fighting against the man. Despite all of these, the police told me that I’ve already gotten the best deal possible since they’re deporting him (that man is a foreigner on visiting pass) because they only found photos/videos of my upskirt i.e. first offence. I felt that it wasn’t a heavy-enough punishment, as he could have at least been jailed for a few weeks before getting deported? Especially when there are concrete evidences and the actual victim was there to give fresh first-hand recount etc. Yet the police told me to let go of this. Till this day, I’m still very paranoid of taking escalators alone and even just being alone in public.

In this case, the victim had it worse than me (she wasn’t even clothed at all) yet the prepetrator’s punishment was non-existent, which doesn’t make sense at all. I really hope that the police would revise their punishment of Nicholas Lim... As for why I’m writing this here, I’m too chicken to bring this up to public whatsoever. Nobody except my immediate family and boyfriend knows about my upskirt incident and even at that time, my parents blamed me for wearing a dress (despite it being long). I feel ashame that I am a victim for something like that and I’ve been made to feel that it’s my fault by my parents and the police."
61852,"Given the recent saga on guys trespassing toilets of hostel, do you think it's time that each hall should be restricted to a single gender? Opposite gender found in the hall will be subjected to harsh penalties (fines, suspension, termination of studies). This is the only way which we can prevent future incidents like this."
61850,"@ #61511 The lowest set of grades I know of that still made dean's list are around {A+, A, A, A, A-}.  Of course, this is only based on what I know from personal/friends' experiences. There might have been lower grades admitted, but I doubt they'll be far from that which I've mentioned. 

That being said, I personally don't think it's always helpful to bank on a specific set of grades when it comes to percentile-based criteria (which the dean's list is based on), though hopefully this information will help with managing expectations. All the best! "
61849,"#61849 OP here: For those interested in my double life in a sugar relationship:
- No, in fact, he encourages me to date other men, especially men my age. Exclusivity is not a term between us. However, I have never being in a proper BGR, my experiences has always been with SDs and lovers. Should I have a BF, I would want to be faithful to him. 
- Arrangements either goes by monthly allowances or Pay Per Meet. Personally, I only accept monthly payments. He provides for my living expenses and tuition fees. Though I have a proper part time job drawing $1k monthly while studying, it's insufficient. 
- Not always. I know a particular dude who was once a high end male escort and had women taking care, grooming him to be a successful (wealthy) individual. Now, he's 'paying forward' to help girls out ???? But I have to say such cases are rare especially for a male. He's charming and intellectual to begin with, he just get resources in such a quicker method. 
Am lucky to meet my current SD and we've been together for 1.5years. Neither the wealthiest nor most good looking, but well off and decent looking. Respectful and caring so far. We do activities together: swimming, reading books, having McD at 3am. I have met public figures before and most are petty douchebags! 

Also, thanks NUSWhispers for this platform to comment on such topics given that none of my family and friends know about this. :) "
61845,"Here's a story:

There was a conflict between a 2 members of a group project. The guy complained that the girl was not contributing to the project. The girl claims that the guy harrassed her. 
This case was brought up to their teachers and school. Nothing much happened to the guy, he went on with his usual life. The girl was counseled, brought to the hospital and kept in the mental ward for days. She was then suspended for the rest of the semester.
They told her hush hush, don't make a fuss of this small matter. The same thing they told to many other girls. To be given a chance to complete her studies, she chose the only route she could take, one that the many other girls took. Only one other girl decided otherwise.
"
61844,"Regarding the issue about the recent incident in the hall near FASS. Now that the school has apologized and reacted to the situation, and with the guy cowering in fear, not being to show his face in public, the victim has gotten her way and I'm happy she has gotten her justice. :>

But I feel a very slight regret in having supported her. Identifying the guy, along with photos of his friends while asking news publishers to cover her story for revenge just wasn't right. I think this is known as doxxing, which is also a criminal offence. She could have at least censored the faces of his friends and maybe even his identity. She has gotten her revenge now that the perpetrator will never be able to step out in society ever again. kinda having mixed feelzz about this.

She had my sympathy at the beginning of this saga, but now it seems the attention is getting to her head - her instastories that just a few days ago borderlined desperation [that baited my sympathy] now stink of arrogance, and for the wrong reasons."
61843,"Need advice: there’s this guy I’m seeing regularly...we go out on dates sometimes and have sex sometimes...but he never ever touches me in public—no handholding no arm over my shoulder. He only touches me in private. 

He also makes me go down on him a lot— like every single time we have sex but NEVER goes down on me or even does any foreplay. He thinks penetration is enough to get me off although I’ve told him multiple times to try some foreplay. Question: Is he just dense, or selfish or does he totally not care about my feelings? He hasn’t introduced me to any of his friends either:("
