tag,text
56413,"OP of #56375 here,

@ Ck Fong
Appreciate your well-intentioned (?) advice, I agree with you on the cheatsheet part, but perhaps I should have provided clearer context in my efforts to protect my anonymity. AFAIK, there are only 2 modules with cheatsheets in the entity of the course. And those modules require more applied response so rigorous information would barely useful anyway. So what about the bulk of the other modules? Also, not everything is MCQ, and MCQs can be extremely tricky if they play with 1 or 2 words you have to specifically memorise to not get tricked. Not forgetting the exam conditions when time is tight and every option seems to be the correct answer. Yes, I agree with your second paragraph, but these questions are minimal and don't forget they still require memory work for concepts across different topics. As for your last statement, sorry to burst your bubble, but not everything can be ""studied smart"". Try memorising chemical structures, biological names, numbers that have no particular pattern all at once.

@ S P Ong
It's not as simple as that. Please don't misquote me, I didn't mention ""just memory work"". Memory work is far from ""just"" and is extremely intensive if it is expected for every single question. It also defeats the purpose of setting an applied question because whether you have a chance to approach that applied question is conditional on whether you first memorised that detail. Not really sure what you're driving at by bringing in your educator experience. Are you sure your class is not simply overwhelmed by the contents in your second mid-terms? (Open-book is one thing, being reasonable about it is another) This may be my own postulation, are you sure you didn't increase the amount of content because it is open-book? But from an educator's mouth, I am astonished by your condescending tone towards struggling students. ""Only losers whine about this kind of thing"". Wow okay, way to go, social justice warrior! I have a better advice for you, if you can't take ranting, don't follow NUSWhispers.

@Prof Ben Leong
You never know, eyes everywhere. ;) Nevertheless thank you for your input, it made more meaningful sense without that tinge of condescension in the former. I largely agree with them, although I am still against the idea of using the stick approach on university students since we are expected to be independent adults. That being the adopting of cheatsheets in place of open-book tests to ""force the students to consolidate and summarise what they have learnt"". Maybe I haven't clearly stated it, but I am not against the idea of cheatsheet examinations. I barely even have them! Or maybe I'm being unappreciative of the mere two cheatsheet exams I have, but welps.

@Henry Goh
Couldn't agree with you more! ""While it is good to know a lot and be able to come up with theories and processes that are textbook based, it doesn't train students for the workforce. Applications of knowledge is where the value add is, not regurgitation."""
56408,"Between majoring in sociology and economics, which has more career options? Bcos tbh, I don’t have a specific career plan so I think it is better if I major in something that has more options. Please do reply for this, I would appreciate your opinion. I am deciding on this now bcos my plan of majoring in psych has failed bcos I didn’t manage to get a B- for PL1101E."
56407,"I have seen many individuals with lots of passion when they first entered uni. After a few sems, just because their result does not tally with their passion, they start complaining how much they regret choosing that course. 
If you really like the course, you wouldnt care what grade u get, just enjoy the content and graduate happily."
56406,Hi Seniors! Any advice on the workload etc for GET1042 Sky and Telescopes? TIA
56405,"Admin please do not censor. I am really curious to know if i stand a chance for Dean's list this semester. Studied my ass off to get a 4.8 SAP for 4 mods. I took 5 mods and will be utilising su for one of them so ultimately 4.8 Sap for 4 mods. I am currently in my last year and have always been poor performer.

Would like to get a feeling about my chances for deans list"
56404,"Next sem is Y2S2. I still have some UEs to clear and my current CAP is 3.78, but that will leave me with no more SUs left. If I save up on 1 SU, then my CAP will be 3.75. Should I keep the SU or just use all of it?"
56402,"Hi! To all seniors out there, is anyone taking a double major of psychology and sociology? How’s the workload so far? Would you recommend it? I’m interested in these two subjects but haven’t come across any seniors who are taking such combination. Is there any reason why a combination like psych and soci is not as common as compared to like psych and sw/econs/biz or soci and sw?? Hope to receive some advice on this!Thank you:)"
