tag,text
62798,"Before the exam, Prof Aaron said not to complain about the CS2100 paper in NUSWhispers. This is not a rant, but I would like to take this opportunity to thank Prof Aaron and Adi for setting this challenging paper. Through this paper, I realise there’s a gap in my knowledge and there’s just still so much more I can learn from CS2100. 

I hope that the future batches taking CS2100 will look at the past year papers (including this one) and realise early where their gaps are. I hope that all these papers can serve as a stepping stone to improve the quality of students in SoC. 

It was one crazy ride. I can never look 0s and 1s the same way anymore after this module. To my fellow CS2100 cohortmates:  we finished CS2100. Congrats to us! Give yourselves a pat on the back, regardless of how the exam went! 

With this I end this post.

HAND
anonymous "
62794,How far is it true that CS1010S is not graded on a curve? Is there strictly no curve or is there still some sort of moderation ?
62792,"In response to post #62733. 
A Master in Management (MiM) is a pre-experience management degree, while an MBA is a post-experience management degree (typically requiring candidates to have at least 3 years of work experience). 
The content of MiMs at most business schools are very similar to an MBA syllabus. The difference lie mainly in the mode of delivery. MiM is more theoretical while an MBA is more case-study focused, and allows candidates to draw on their fellow classmates' varied work experiences. 
Career progression for both differs too, mainly due to the W.E. MiM graduates will be recruited at analyst level, while MBA graduates will be recruited at a level commensurate to their previous W.E and position. 
MBAs are very popular in North America (being a product of American Business Schools). MiMs are very reputable in the European market (being a product of European Business Schools). In Europe, the concept of MBA is unfamiliar as students typically proceed to their post-graduation studies after undergraduate. An MiM could be seen as the cousin to the MBA. However, US Business Schools have recently been expanding into the MiM market (i.e. Duke, Northwestern, Kellogg). "
62790,When you're a CS student but you remembered that you haven't made fun of an IS student today
62788,"Would like some advice on whether i should give up my malaysian citizenship. 

I was raised in Singapore, so i pretty much speak and relate to the typical singaporean life. To me, Singapore is my homeland. With all these being said however, i still feel a sense of affilation to Malaysia. After all, it is the country where all my relatives are based and i have alot of fond memories there. I love the beautiful landscapes, the people and the food. 

And i always had a dream of making Malaysia a better country especially for non-bumiputeras. I dream of becoming rich and maybe even starting my own business, possibly being the next robert kuok so that i can perhaps, help to improve the facilities and infrastructures in malaysia and help play my part to make it a more fair playing society. I must admit, it is honestly a fair fetched dream and i don't have the slightest idea on how i can accomplish that, except maybe study hard now and think of how i can start a business to be rich?  

Given my love for both Malaysia and Singapore, should i give up my Malaysian citizenship for a Singapore one then? There are definitely more pros than cons to owning a Singapore passport and for many years my relatives in Malaysia are always in disbelief when i tell them i am still a Malaysian. They have always told me to give up on malaysia..saying there is no more hope for non bumiputeras here...

I am slightly conflicted. To be honest, i don't dare to own up that i am Malaysian because i never grew up in Malaysia and neither do i speak Malay or have a good grasp of dialects. On the other hand, i cannot call myself Singaporean too :<"
62786,"I'm the one who posted #62680. Thanks for all the concerns and help in reaching out to talk to me. But i really dont feel comfortable telling my stuffs to people that i just know, it took me some time before i started telling things to my good friend that left, my good friend left because of my negativity and arguement between us, its just so hard to focus on the things that matter now and it just adds on to the stress I'm facing. So I decided , I'm going to go for counselling after finals , because even I , am afraid of myself. The thoughts of ending everything feels so comforting when i feel sad and useless. And sometimes it really hurts to think about what happened between my friend and I, my results, my life and everything. It hurts so much that i really feel my heart aching. So to prevent some things from happening, i will attempt to share everything with the counselor if i feel comfortable enough..."
62785,"“I would rather prioritise work for now” 
“You give a lot for love and prioritise it very strongly, you can't expect me to be the same. I don't prioritise love as much as you do“ 
“If you want someone who prioritises love, I'm sorry I am not that person and you deserve that person”
I have been with my bf for close to a year. Since the start of this year, we’ve had countless arguments regarding the same issue — he outrightly claims that he prioritises work over anything else, and our relationship is the least of his priorities. This is very harsh and hurting, I feel undervalued and treated like trash. He says that he still loves me, but is unable to devote time & attention. This is so upsetting, please help "
62783,How did you all find the MA1512 paper? please tell me the majority of you were struggling with it so that i’m sure to get my A+ ;)
62782,"Well, I can finally safely post this now because it's too late for any changes.

To those whiners that complained it's unfair that they don't have GC calculator yet the linear algebra exam allowed any type of calculator (as long as it does not provide communication), you just have to sucked it up. This is the real world, survival of the fittest, natural selection. You either adapt (buy a GC calculator) to live through this crisis or suck thumb."
62781,"Fresh grad. Nothing to do. How do I impress a gamer girl? Like a real one. Not the kind who just shows boobs while streaming, i.e. female ""DJs""."
62779,Did anyone pick up a small black earphone pouch on D2 or at Computing? I lost my earphones. It says shure on the cover. Please comment and I'll pm you. Thanks a lot :(
62778,"Hi I need some advice here. I'm dating a guy who is going to an overseas uni so we might eventually part ways since I am studying locally. To those who have gone through similar things, how do you eventually move apart from each other? Do you still stay in contact?"
62777,"Took a grab to exam today. Grab driver asked ""you so fat go sports hall for what?""

I was prepared to take my exam, not for this!"
62776,I'm taking a level 4k module with 40 students in the class. Does that mean that there's a bell curve for it? 
62775,"Last year sem2 in CS2100 finals, t(h)an(os) snapped his finger and half the cohort don't feel so good, will the cohort taking CS2100 finals in this year sem2 prevail or will t(h)an(os) win again?

CS2100: Endgame 5pm-7pm 2nd April 2019 (limited viewing at MPSH)"
62774,"Hello #62774, I used to seek treatment for trauma+depression. This reply is mainly about the medication part that you mentioned. 

Do you know what meds she's taking and what their side effects are? From my own experience, it is possible that taking meds or even changing/stopping dosage can cause big changes in energy levels and personality. The patient may also not notice the changes as much as the people around her. 

This is a long shot, but I might as well make the point with my own horror story coming off Paxil. I took 10mg of Paxil per day (half a pill) for 2 months, and it worked initially. The psychiatrist then told me I could stop any time due to the low dosage, and never warned me about any withdrawal symptoms. So I stopped, and had quite strong physical and emotional side effects for two weeks (similar to the stories here: https://seroxatsecrets.wordpress.com/2008/01/05/the-hell-of-seroxat-withdrawal/). It was only later that I realised how oddly I was behaving to those around me. 

Anyway, it can be serious stuff, and it's good that you are observant and in touch with your person. Maybe you can try to find out more about the medication, and see if there's anything that doesn't add up, or seems dangerous. It's not easy caring for someone without enough knowledge. All the best!"
62773,Is anyone heading to Korea University this summer? I'm going alone and would like to get in contact with other nus peeps! :D
62769,"Girl who posted #62605 here. I’m very happy in my current relationship. So nope, I’m not looking for anyone to PM or date me. But if you’re a SOC guy interested in a SOC girl who’s already told you she’s single and dropped you a few hints she may be interested, please stop waiting around and make a move already!

To #62642: If you don’t get why guys should take the initiative, it’s very simple. An average girl in uni usually has more than one guy interested in her at any one time. Some of these guys would be actively pursuing her, and taking up her time and attention away from you. Unless she has the opportunity to get to know you for an extended period of time (like what happened with me and my boyfriend), her interest in you would have already peaked and faded some time after meeting you. If you don’t make the 1st move, she might never get the chance to know you better. So if a guy wants to play the waiting game and wait for the girl to make the 1st move, good luck to him! If it happens, he’s a very lucky guy. 

To #62634: You sound like the typical sweet but hopeless/clueless SOC guy I mentioned before. If you’re trying to read and analyse your girlfriend like a computer program, please stop. Girls are more complex than just a bunch of 1s and 0s. Also not all communications are verbal. If your girlfriend is exasperated, it’s because you’re only paying attention to what she says, not what she communicates. There’s a difference. If she loves you enough, she’ll try to teach you. If you love her enough, you’ll try to learn. Good luck!"
62768,"Hi, i'm a non-soc student who just completed cs1010 this sem. If i want to continue taking cs mods next sem should i go for cs2030 then cs2040 or cs1020 then cs2010? Any advice? thanks!"
62767,"I graduated a few years back with a non-honors degree. Now I realize that I want to learn more, and am thinking about going back to school. Is it possible under NUS policy that I come back and complete the honors degree?"
62765,"To: #62830;#62765
I raise you one better. Great Eastern, Prudential, Aviva, AIA. 
Only if you are from engineering.   "
62764,"Saw some post recently about dating on CMB and Tinder, so I'm here to share my story

I'm a guy and 2015 Dec was when I downloaded CMB and Tinder and started to use the app in hopes of meeting new people. I used it for 6months maybe but with no real results, mostly didn't click well or just no chemistry and the daily girls I got from CMB became lesser (maybe due to my filter criteria). 

So in 2016, I decided to try out a dating agency GG (I'm quite sure you guys know which one) and signed a package with them, hoping through them will be more focus and higher match rate because of common interest. First girl didn't work out and I was together with girl no.2 (after 4 months of trying to win her). I stopped using the apps during this period. It was a good run, but we ended after 5months.  

I continued to use the app through 2017, going out as frequent as 1-2 girls a month and continued the service by GG. In 2017 sept I met this gorgeous lady which we click very well and we were on the same frequency, however it was quite shortlived after 1 month. I should have read the signs, she was merely using me as companion because she broke up with her ex one month prior. I took awhile to pick myself up because it really hit me hard, I thought she was it.

I continued to use the app to get my mind off things and to move on. In early 2018 I matched with this girl who is totally not in my criteria but decided to give it a go. We dated and got together. Fast forward 1 year later, we are talking about houses and family planning. 

TL;DR: Just keep going out and date, you'll meet many wrong people before you met the right one. Don't give up hope."
62763,"Anyone ever extended graduation simply because he/she wanted to learn more stuff from other faculties? Engineering major here.

No, I don't plan to study banking related stuff (but then again, why not)?"
62762,What is the criteria to apply for a second major in computer science? I know the NUS website says a minimum of B+ in CS1010/ its equivalent and CS2040 is enough but I highly doubt so. Is getting a A- in CS1010s and B+ in CS2040 good enough?
62761,Would like some advice on honours year for nursing. Nursing seniors do help :) is it worth taking year 4 honours if you do not intend to further nursing career into the research field? What are some pros and cons? 
62760,"After breaking up with my toxic bf, one thing I really lost was wearing the comfy army pants. Anyone can tell me where to buy them? Thanks. "
62758,"I had a crush on this one girl for quite some time and as time goes by, I found out my bestfriend also has a crush on my crush. I was being jealous whenever he tried to be close to her. So to prevent him being close to her, I confessed to my bestfriend that I like him. Ever since that confession, we both stop having a crush on the same girl as we are now in a relationship."
62756,"before enrolling in NUS, u must take a health screening right? If u have an std (not aids or HIV), will NUS rescind your admissions offer?"
62754,Why is everyone who has entered the workforce telling me to treasure my time in school? I really can't wait to get out. Anyone here prefers working over uni?
62752,"Is doing well for the interview and test sufficient enough to secure a prospective student a place in the Industrial Design course at NUS ? Does one not need a high RP or GPA to get in ? I checked the IGP but am not sure how it’s a deciding factor for enrolling prospective students. Hope someone can enlighten me, thank you. "
62751,"Just curious and posing this question out there to all fresh grads last year. I believe most of us are in the work force right now be it full time or part time. Y'all must have handled some projects or assignments passed down by your superior. Are your superiors all somewhat demanding and rigid minded? Micromanages the details of your assignment? Gives you vague details and information and expects you to produce a decent result for him or her? 

Because mine does. Not sure if I'm being picky or simply can't tolerate the way she treats me, but somehow I feel that she is just out to get me. I'm scared."
62750,"Looking at what IS students are learning, I kind of feel like CS doesn't really prepare me for real life. Fellow IS students have modules on all modern frameworks like angular, android, ionic, web dev, and even database is their core and not CS core.

Whenever I saw the internship emails from the school, they are always looking for skillsets in these web or mobile or analytic areas. I look at the stuff CS teaches and none of them fit into any of these roles.

Granted, I understand that at the core, CS teaches fundamental knowledge to pursue deep and technical areas, and does not simply prepare one for development jobs that one can learn on the web anyway. Still, at least, little of what job titles are looking for at fresh graduate level are taught in the CS courses.

Of coz we can always pick them up on our own. It is just that IS seems to be more practical and have real life usage than CS. Well.. "
62748,"hi Jonathan Choi, 
sos please! i have been going out with a guy for almost a year already but i am still confused on what we are. how do i escalate it to the next stage?"
62746,"To girls, is it very remarkable if a guy is an Officer? They all seem very impressed when any guy mentions it. What about their impression of non-OCS guys?

- fellow girl
"
62744,"Does anyone feel that CS lacks rigour compared to Math? 

I've always found that a lot of CS theory (or at least how it's taught in the modules) play hard and fast with the mathematics involved. It's honestly kind of aggravating, especially when it's evident that the profs gloss over parts that they themselves don't seem too clear on. This is especially bad when some of the “proofs” the CS profs give rely on the abuse of notation or terms used..

This also seems to play into how CS modules seem kind of unstructured, especially (at least, to me since I take CS and Math modules side-by-side) how they’re taught; a typical Math topic has examples designed to illustrate a particular facet or consequence of a theorem or problem, whereas all the CS topics I’ve taken seem to involve logical leaps that the profs just kind of gloss over (or outright admit that we somehow “have” to make the leap).

Part of this is also me just ranting about how CS just doesn’t seem to have its shit together compared to the Math department; I’ve never had a Math prof be unable to answer a question, whereas I’ve had that multiple times. I’ve also never had a Math prof abuse notation or specific terms as badly as some of the CS profs I’ve had. Does anyone else feel this way?

Sincerely, a disgruntled CS/Math DDP student.
"
62743,Yall say soc guys are slow when it comes to relationships but i think engineering guys are the slowest to figure iut if you're interested or not. Like i get a time limit exceeded because hes just so slow. Come on i literally take the initiative in everything but he doesnt get it. Wait... Or is he not interested ? Gg did i play myself
62742,What modules rank amongst the hardest in NUS? Note that what i mean by hard is hard because of content and not because mod was badly designed. 
62741,"Is RC4 a very boring RC? I applied for it, but after hearing some seniors say that it's got the least culture/distinguishing points of the utown RCs, I'm wondering about it. What are the cultures even like (or supposed to be) for individual RCs? Is there a chance of changing my residential application to the common pool for all RCs instead?"
62740,Evergreen guy here and recently got to know a girl and we have mutual interest. But I really love my current independence and freedom and don't wish to give it up. Is it possible to be in a relationship and yet still can enjoy the independence and freedom a single guy has? I have seen how attached or married people have to give up so many of their hobbies/ sleep/ time/ social life/ whatever for their partners and I don't want to end up like them. Would love to hear the perspective from both guys and girls. Thanks!
62735,I'm an international student and been in NUS for 2 years and havent even had a chance to meet any girl to date. How do other fellow international students get dates and hook up? Can it be cause I dont use facebook?
62734,"Do you ever think about how people with exams spaced out evenly have more time to prepare than those who have their exams all packed in a few days, and how they could potentially score better than you? "
62733,"In response to post #62733. 
A Master in Management (MiM) is a pre-experience management degree, while an MBA is a post-experience management degree (typically requiring candidates to have at least 3 years of work experience). 
The content of MiMs at most business schools are very similar to an MBA syllabus. The difference lie mainly in the mode of delivery. MiM is more theoretical while an MBA is more case-study focused, and allows candidates to draw on their fellow classmates' varied work experiences. 
Career progression for both differs too, mainly due to the W.E. MiM graduates will be recruited at analyst level, while MBA graduates will be recruited at a level commensurate to their previous W.E and position. 
MBAs are very popular in North America (being a product of American Business Schools). MiMs are very reputable in the European market (being a product of European Business Schools). In Europe, the concept of MBA is unfamiliar as students typically proceed to their post-graduation studies after undergraduate. An MiM could be seen as the cousin to the MBA. However, US Business Schools have recently been expanding into the MiM market (i.e. Duke, Northwestern, Kellogg). "
62732,"Don't know if it's because finals is coming or because I'm worried about something else... Feeling rather depressed nowadays, and thinking back to y1 orientation.

I had a crush on one of my OG mates, and still do. I had hoped that we'd be able to stay as friends since her course actually has more girls than guys even though it's an engineering course... and I thought I stood a chance.

Then I discovered that she's attached, sighpie. She's just recently posted their 6th anniversary picture and I'm just left thinking how I didn't see that coming. Thing is, I knew the guy briefly but chose to stay away because he kinda had a bad rep as a player. I'm not sure what she sees in him, but I guess to each their own. Sometimes I think maybe people really do go for the bad boys, not saying that I'm a ""nice guy"" but this guy would definitely fit the bill.

Oh well, rant over, back to mugging."
62727,How do you know whether you're in a toxic relationship? I'm starting to think I'm in one...what are some red flags
62724,"Why do i feel discrminated as a local in the work force? Im currently working in those big technical consulting companies for 2-3 years and I am always allocated to public sector projects because I am a local and they need headcount to fulfill their requirements. Sometimes, I secretly wish I was a foreigner so that I can be treated as a ""special"" hire and be allocated for more interesting projects."
62723,"Why did I ever leave you? I was a fool to think I could ever do without you. I miss the way you made me smile; the way you made everything make sense. Without you, everything is just an uncertain, confusing and dismal mess with ""no right answers"". 

Dear STEM, please take me back. 

-An ""Arts/Biz"" Kid"
62722,"I just finished a paper yesterday. For the CA, the median is probably close to 60/60. The finals was really easy too, probably with a close to perfect score median. 

In this case, how are they going to curve the grades? Based on IVLE, there are only 34 enrolled students. The curve as it is won't be representative of the population due to the small sample size, and given the fact that the paper was so easy, would it mean needing > 90 for a B+/A- or even 99/100 for an A?"
62720,"I'm considering dropping out of my course. 

I know it seems a bit of a hasty decision to make as a first year, but I just feel like I can't. Take. It. Anymore. Every day pretty much feels like torture. Don't get me wrong, I'm thankful that everyone around me has been really supportive and they've tried their best to help, but even up till now, I can't understand the simplest of concepts which are integral to the continuation of my studies. 

I keep getting Ds and Fs. The one time I decided to give up on all the other modules and channel all my efforts into just one, I managed to force it up to a C minus--a very bittersweet moment for me. But that's it. It's not gonna be enough to compare to the sea of As and Bs that I see other people get every day; the As and Bs that employers are going to want. 

I'm too dumb for this shit, guys. 

All the best for exams. Y'all will do fine.

Yours sincerely,
The one who is pushing the bell curve in your favour"
