tag,text
58299,Thought they would've thought of this idea much earlier
58296,"The girl in black shirt who transferred frm 189 to 183 today morning, just wanna say i find u cute! "
58294,"On this hallowed 14/2, I want to wish all mgtow men a very happy mgtow day! 

If you have a wonderful gf, good for you! But if you’re single remember, it’s way better than having a shitty one! "
58292,"Guess whose boyfriend forgot about valentines day today and is going clubbing with his friends today? He kind of just... forgot. I am disappointed but I am going to use today to love myself instead. I'm getting my hair and nails done, maybe a facial or spa if I'm feeling up for it. While waiting to bring my man home probably drunk, I'm going to binge watch our netflix series without guilt. I am going to the fancy restaurant I booked as a surprise and eat alone and I'm going enjoy it. I love you, but my happiness is worth more than your absence. "
58288,"My friend is depressed. He does not want to see a counselor because he can't open himself to a stranger. He says I can help him by simply keeping him company, but it feels hard to keep him company without being pulled down. I suggested to him that he should befriend more people to keep him company, but he claims that he can't do it with many reasons. I am trying to maintain a distance from him but he seems more depressed because of that. I am trying to take care of myself and I hope he can take care of himself too."
58286,"I hope that the people who bullied me and caused psychological torment and distress to me during my JC days get comeuppance and just desserts one day. Bullying is so serious. Even words have the power to emotionally hurt and scar people for life. Thanks to them I became so paranoid about the rumours, gossiping and slandering that I eventually developed an anxiety disorder and depression.

Meanwhile, I am staying committed to striving to become a stronger and better version of myself each and every single day. And I definitely have improved so much over the past few years. More resilient, more stronger, and mentally more tougher.

Okay, thanks for reading this... Just wanted to get it out of my chest... :)

P.S. The only regret that I have was that I was not more assertive in the past, but at that time I did not learn how to do so."
58284,"Hi, I am the one who posted #58259, the aspirating monk thing. Aspiring as in not a monk currently, but wish to be one in the future. It seems that a lot of people don't get that. I am still a lay person, have hair, normal clothes etc. So think of me as one of you, but just with a goal most of you do not have. Also, this is not a troll post. I realized that some of you think that it might be a troll post because you mistook me as a monk. That's a pretty bad image to put into your mind, I apologize. 

Also for those not familiar, being a monk does not make one automatically have no more lust. Mental cultivation is needed. So it's the path to reduce and eventually get rid of lust. But as long as I am a lay person, there is no reason why I should remain celibate, other than pre monk training.

Thanks for those saying FWB, I don't think my conservative self allows that too. I can't even think about it. Also, not much female friends I know who is that liberal, and attracted to me as fwb. 

Emotionally however, I am currently falling for a very pretty girl, good thing we live far apart from each other. But my logical, rational mind doesn't allow me to initiate chasing her at all, even as a what if fantasy. I got over the hating self thing due to this internal conflict, but just wish to rant here as the training does not recommend suppression of feelings, nor acting on lust, craving. Just merely observe it is good enough. I am just afraid too that this Valentine's when I met her in a public talk, I might confess. I really shouldn't. "
58283,"This Valentine's Day, I am gonna leave you for good. You knew I cheated when we were together and you said we should carried on. Okay....Great, I finally found the somebody who truly loves me despite my clubbing and hooking up days, you then were so, so willing to love me. Boy, I was terribly wrong. Fast track forward, giving you 3 kiddos ain't enough to show you how much I am willing to change to stay with you, you took it out on me using violence and verbal abuse (c'mon, beating me and reminding me how slutty I used to be and no one is gonna take me now. Ha! what a loser)!! Hey, hey, hey, be a man please. If you want to rack up my past and for us to divorce, just say so, just don't take it out on me anymore during your drunken state. 

Today, I will fulfil your wish, we are ending, I'm gonna pack up and leave. You can have everything (house, kiddos, money), I don't want anything to do with you anymore...."
58282,Any poor guy forgot to book a restaurant for v-day? I have a reservation at 8pm at Hararu Izakiya/Blue Jasmine (both halal) for 2 depending on my gfs preference. Please post here if you are interested
58281,"To all those who haven't found someone to love for valentines day. Before you love someone, you need to know how to love yourself

You need to learn to 自恋"
58280,To anyone who is attached - have you ever met another person that you know will be suitable for you? How do you deal with it?
58278,"To #58260: I am neither HIV+, nor identify as LGBTQIA, but I am fully against someone who claims to be fighting for the LGBTQIA community and HIV+ community by leaking the HIV+ registry for the world to see. Not everyone who is HIV+ has told their relatives and friends, and for some who do, they unfortunately have associates who are not so understanding due to the long-held stigma HIV and AIDS have in this country. If you ask me, it seems like Brochez is the one throwing the HIV+ community, and the LGBTQIA community due to his orientation, under the bus with his actions.

I would really like to see what evidence he has. As for now, my stance is ""Mikhy is a liar and he cannot be trusted"". He can release his evidence to change my mind. As much as the ruling party is not 100% trustworthy, at least acknowledge that, as the party that runs this country, they should, and do, have the interests of its people at heart at times, even though some of their policies make people go ""WTF, are you acting against my interest?"""
58277,"Going to graduate this sem, i really regret study engineering. Other faculties are getting so much better job opportunities in term working environment and compensation. FML"
58276,"Should I feel disappointed if I don't get to receive any flowers or gifts from my bf on Valentine's Day when I spent efforts preparing a gift for him? 
"
58275,"I would really like to reconnect with my love interest from the past. Thought of asking a mutual friend how that person is doing, but i don’t know if that will come across as stalker ish or just a normal thing. Because its really awkward and hard to get to her directly. Not exactly very close to this mutual friend though, that’s the problem. It might come across as like a random stint?? Dunno. Help!!"
58274,"Good for you people if you do spin and exercise classes for your own health. But why do you need to post every class on instagram? Okok you girls might say it is your own account and you can do whatever you want, but don't use exercise as an excuse to gain some attention on social media. Exercise for yourself and not for the gram."
58273,"Why are badminton/squash courts in the USC closed after evening? We should be allowed to play some sport during late nights too. Enforcing timing is not the best idea.

Please like/comment if you agree (and please tell whom to contact for making this change in NUS)."
58271,"To all the singles out there feeling bad about themselves: It's probably not your fault. There are many decent people who are unable to find a partner because they are simply physically unattractive. It is sad but that's the way it is.

Friendly reminder that Valentine's day has the highest suicide rates, so please be extra nice to everyone and improve the statistics. You could save a life.

We are not alone in our suffering on this blessed day, just think of all the hikikomori in Japan and incels in America created by hypergamy. Choose the cope not the rope."
58269,"Being from a lower-income household, I cannot wait to graduate and start working and earning a decent wage rather than being my measly 1.8k per semester living allowance loan.I have to miss out on so many things in life because of my tight budget and my family's financial situation.It was all good for the first 3 years until my NS savings were slowly wiped away but now in year 4,its been a really depressing to have lousy standard of life and not being to afford anything apart from necessities.I am just offering another perspective on the work vs study debate.Anyone in the same boat as me?"
58268,"Y4 male student here. My Skillsfuture account had $500 credited within the past two weeks. What are some good courses to take? Am considering between SP's ""Post-Diploma Cert in Fundamentals of Data Science"" (which will lead to a Specialist Diploma if I take another post-diploma cert) and other Excel courses from People's Association/NTUC Learning Hub. Folks who used up their Skillsfuture credits, please share what you did. "
58266,"What am I doing for Valentine's Day tomorrow.

With my Java, and sun-fire and me.. ee

#CS2040"
58265,"I've been single for the past 2 years and honestly I'm getting kind of tired of being alone. I've been on dating apps too and unlike many of the confessions here it really isn't that easy for a girl to have a good match. Even though I initiate the convos and keep them going, checking their bios before asking qns (considering I always get asked what my hobbies are when I already listed them), I still get ghosted at the end of the day. 

Valentine's day's rolling by tmr and I'm so bitter by the sight of couples planning for it. What can I do?"
58264,"Byo Gond?
GO Bring Your Own ND?
Go Byond?

Probably the last one. Not sure who approved this but all the best for your event nevertheless.

(Seen at UTown Plaza)"
58263,I thought I would enjoy my new job but I don’t. I am also not sure what to study as my grades were never exceptionally great. I am lost and I don’t know what step should I take next.... 
58261,Fear of applying for jobs? Never experience this form of anxiety before. How to cope?
58260,"To #58260: I am neither HIV+, nor identify as LGBTQIA, but I am fully against someone who claims to be fighting for the LGBTQIA community and HIV+ community by leaking the HIV+ registry for the world to see. Not everyone who is HIV+ has told their relatives and friends, and for some who do, they unfortunately have associates who are not so understanding due to the long-held stigma HIV and AIDS have in this country. If you ask me, it seems like Brochez is the one throwing the HIV+ community, and the LGBTQIA community due to his orientation, under the bus with his actions.

I would really like to see what evidence he has. As for now, my stance is ""Mikhy is a liar and he cannot be trusted"". He can release his evidence to change my mind. As much as the ruling party is not 100% trustworthy, at least acknowledge that, as the party that runs this country, they should, and do, have the interests of its people at heart at times, even though some of their policies make people go ""WTF, are you acting against my interest?"""
58259,"Hi, I am the one who posted #58259, the aspirating monk thing. Aspiring as in not a monk currently, but wish to be one in the future. It seems that a lot of people don't get that. I am still a lay person, have hair, normal clothes etc. So think of me as one of you, but just with a goal most of you do not have. Also, this is not a troll post. I realized that some of you think that it might be a troll post because you mistook me as a monk. That's a pretty bad image to put into your mind, I apologize. 

Also for those not familiar, being a monk does not make one automatically have no more lust. Mental cultivation is needed. So it's the path to reduce and eventually get rid of lust. But as long as I am a lay person, there is no reason why I should remain celibate, other than pre monk training.

Thanks for those saying FWB, I don't think my conservative self allows that too. I can't even think about it. Also, not much female friends I know who is that liberal, and attracted to me as fwb. 

Emotionally however, I am currently falling for a very pretty girl, good thing we live far apart from each other. But my logical, rational mind doesn't allow me to initiate chasing her at all, even as a what if fantasy. I got over the hating self thing due to this internal conflict, but just wish to rant here as the training does not recommend suppression of feelings, nor acting on lust, craving. Just merely observe it is good enough. I am just afraid too that this Valentine's when I met her in a public talk, I might confess. I really shouldn't. "
58258,I’m a gal. I am not jealous if my boyfriend who drives sports car talks to other girls. In fact I am ok for threesome and want to go karaoke session with him and other hot young girls which I am fine. I don’t give a shit. I have worked as one of these karaoke girls before and hence perhaps know the girl’s mind or thinking. Usually these girls are just working. They are not thinking to seduce your bf or Husband. In addition I have a lot of party girl friends and I am ok if my bf dance with them. Am I abnormal? 
58254,"#58228 organiser of the matchmaking here-- please be patient as we have 330+ responses to go through (no, we didnt automate it, we didn't expect such a large response). If you had taken the survey, it mentioned full release of matches by noon of tomorrow, and we hope to get it done by then. 

As pointed out by another commenter, there is a very skewed gender balance of 20% female, 80% male. So this is the hard truth: most of you wont get matched. But basically you'd know by noon. 

We're thinking of doing friendship matches between guys, see how that goes. 

But in any case, we understand that some people might be anxious or impatient, so we'll do a partial release tonight. "
58253,Going to spend v-day in class with my rather inappropriate crush. Help.  
58251,Suggestions for singles spending V day alone tomorrow?
58249,"To the spineless dingbat in today's tutorial: Good job taking my content from last class and passing it off as your own, word-for-word. It must feel really good knowing you don't have any existing brain cells to use (or effort to try and at least give an original thought of your own) that you have to plagiarise from someone else, right in front of them. Have fun trying to keep up your plagiarising streak in your subsequent classes, you moron. "
58245,"Hi everyone. I'm not sure if I'm even allowed to make posts here, as I'm not affiliated with NUS in any way. I've been looking to pursue graduate studies at NUS, and one of my acquaintances informed me about this forum.

More specifically, I'm looking to pursue a Master's degree in computer science. I'm currently attending school in Korea (Korea University) and am about to enter my last semester. I've looked on the website and other Internet sources but haven't been able to find answers for my questions regarding the admission requirements.

Currently, my GPA is around 3.1-3.2/4.0. I don't have any official research experience, but I did work for about a year at a cryptocurrency/blockchain-related startup. I took the GRE last summer and got a 163V/169Q/5.5AW.

Right now I'm not sure what to do, since it also seems that NUS requires you to have at least two years of work experience in the IT field unless you have a bachelor's degree in computing. I switched majors in the middle, so I have a double major degree in international relations and computer science.

The realistic option that I've been considering is to complete a Master's degree at my own school (since the bar is relatively low for students who completed their undergrad at the same school) and then consider NUS for a PhD.

What would the community members recommend I do? "
58242,Do girls like dating guys that wear caps or something? Why is it most girls I see have boyfriends always donning a cap for? 
58238,"Hi guys, just curious...what's the average pay for an NUS Research Assistant from a Science background without any programming knowledge? Seems like most RA positions these days actually require some kind of programming background :(
Thanks!
PS: Admin pls don't filter!"
58237,"Sometimes I feel really bad for the people who post on NUSWhispers with serious problems and looking for legit advice. Seems like any serious plea for help garners trollish comments from anonymous accounts. I mean I guess it can be funny sometimes, but I can’t help but wonder if it’s having any negative impact."
58236,"Any INFJ here? Well, I think I really need that one understanding friend sometimes. I care about facts and I care about people's feelings, and I hate conflicts or troubling the others. It's like a fool roleplaying both Atlas and Apollo, live to hold up the world for eternity and ever-ready to enlighten my peers. I'm sorry for all the contradictions if they confuse you. Too bad I'm friendly but always alone.

Please comment if you are an INFJ. I sincerely hope that we can, as friends, shed some light on one another's life and problems. For once, maybe we can be fully understood."
58235,"I'm a foreigner staying in Singapore. I rented a room and am currently staying with the landlords. Previously, I signed a contract with them, in which we have agreed that the minimum period of stay is 8 months. My stay has been barely 3 months.

A few days ago, the landlords told me that they have relatives / friends visiting and they need my room to host them. They asked me to find another place to stay and said they'll give me two months for the rental search.

I am in fact totally fine with moving out, just that I have a lot of luggage to move. I hate moving house; every time I do that I feel super exhausted. Apparently, the landlords don't care. I told them I want to stay for the minimum period as agreed in the contract, but they said no.

I don't want to argue with them (there's nothing serious to be argued for). It will make things even more embarrassing. But then I'm wondering: if the landlords can sign a piece of contract and simply treat whatever is written inside as nonexistent, then what's the contract for?

What should I do?"
58231,"Recently I started to experiment with dating apps. After filtering out disgusting men who just want a free prostitute, I'm left with four or five people on conversation terms. I enjoy courtship but I really don't want to meet any of them in person because that would mean I'd have to stay consistent with my image in my personal social circles instead of having the freedom of doing things that would normally be considered out of character by friends who know me in real life (ridiculing humanity's stupidity, being really judgmental and stuff)

Am I an evil woman who just wants to be entertained? "
58229,"[repost as tomorrow's V] #46631:  My gf broke up with me on valentines just because I could not find an appropriate answer when she asked about my opinion about her bosom which she is very concerned about.

I asked my friend how should I respond and he gave me an 对联(antithetical couplet). Maybe it would help for the boyfriends if your significant other asked you about your opinion too.

乳不贫何以平天下 
胸不巨何以聚人心

If your girlfriend's concern over her small chest, say the former, or she's concern over her big chest, say the latter.

The rough translation for the first sentence is ""Breast not petty, how to calm the calamity""

while the latter is ""Breast not large, how to gather people's heart""

goodluck to all guys with girlfriends."
58228,"#58228 organiser of the matchmaking here-- please be patient as we have 330+ responses to go through (no, we didnt automate it, we didn't expect such a large response). If you had taken the survey, it mentioned full release of matches by noon of tomorrow, and we hope to get it done by then. 

As pointed out by another commenter, there is a very skewed gender balance of 20% female, 80% male. So this is the hard truth: most of you wont get matched. But basically you'd know by noon. 

We're thinking of doing friendship matches between guys, see how that goes. 

But in any case, we understand that some people might be anxious or impatient, so we'll do a partial release tonight. "
58226,"Hey guys, year 3 Sociology student here.

In lieu of the new design-your-own-module initiative launched by NUS, I would like to get a rough gauge of the number of people who may be interested in taking a pass/fail module on anthropology and fieldwork.

I have pitched my idea to a couple of professors and they seem to be very willing to teach such a class.

Essentially, this module would cater to equipping students with the ability to conduct anthropological research in the field. I envision it to be the fourth methodology module (in addition to the three that sociology student already have - qualitative, quantitative, and visual ethnography). This module would take place within a specific field site (to be confirmed) and over the course of the semester, students would explore the field site from different perspectives. For example, the professor would examine the space from a historical perspective one week, and a social perspective in another.

What makes this module interesting would be how it allows the individual to engage with the SAME field site over the course of the semester and have first-hand experience and immediate feedback while conducting fieldwork. In some sense, this module would be very much like a field school but stretched over 13 weeks. This module would be theory-based but more technique base. Finally, I would also propose to invite several established field researchers/ research companies to help conduct some of the trainings or at least get them to come give us guest lectures. This would not only expose us to how commercial researchers work in the field, it would also allow us to make new connections with those already in the industry (which would be extremely valuable if you are interested to get internships/jobs in this field).

Anyway, this is just a rough idea and any constructive feedback would be much appreciated! Would help if you could perhaps comment if you're interested! Thank you for your time in reading this to it's entirety!"
58225,What is with the spin and exercise classes fad among girls these days? Is it really necessary to spend all that money for your fitness or is it just all for the gram?
58222,"Public service announcement: if you spill sweet drinks on the lecture tables, or eat greasy food on the tables, please have the basic courtesy and decency to clean up after yourselves. Don’t be a slob. It’s honestly disgusting when you sit down and realize there is sticky residue from sweet drinks or some oily substance. "
58218,Who said living with math is easy.... I think I am lost 90% of the time T_T
58217,#58132 : Maybe you should stop being such a passive meekling and ask him out! Better than being on the sidelines burning with jealousy!
58215,"creator of #58169 here-- apparently some of yall are looking for friends to hang out with on valentines, not a date. Just to be clear, yes that is perfectly fine. So this is just to let yall know that you can now indicate ""looking for a friend"" on the form! Once again, the link is tinyurl.com/vdaynus19"
58214,"To many asian foreign girls, Singaporean guys are seen as nice, manly, caring and gentlemanly. To local girls, Singaporean guys are seen as some saltly boy "
58211,"i’m a very late bloomer (considering i’m a girl). while all my friends had break outs in secondary one and secondary two, i only started to have years later. by which then, everyone’s skin has cleared up. i feel very self-conscious about my complexion and guys make fun of me and call me names like “moon crater”. i tried everything: sleeping more, eating more vegetables, applying aloe vera, lemon juice, even toothpaste, but nothing seems to work! i’ve been told that i simply have to wait it out, but i feel my self-esteem lowering every single day. not to mention i’m extremely flat too, so i feel very unattractive standing next to other girls. any advice from other late bloomers?"
58210,"I always wanted a bf. But I always couldn’t find the correct one. I am a Christian and believers tell me that it’s better to find one when I’m abit older. I am coming 20 this yr. and I really hope I can find one that’s between 22-23 yrs old. Hopefully, about 1.8m-1.9m tall. Tag your guy friends and I might leave them a pm."
58209,I'm an exchange student here at NUS and I'm pretty shy. I've been here since January but I feel so lonely a lot of times. What are some suggestions of things to do or join that might help me? 
