tag,text
58208,"Hahahas... It's been... 3 years, has it? Since we've graduated, and since I've lost contact with you. The thing I've build, it didn't make enough noise as I hope it'd have, to catch your attention. Well, at least, there's an article about it, so... Here you go:

https://www.straitstimes.com/singapore/transport/first-fully-designed-and-built-in-singapore-bus-launched

If you'd remember, I did say something about ""Hey, please look out for the bus I'm gonna build, it'll be on the news!!"", like, 2 years ago, but it... was a no show.

Out of curiosity, I recently googled your name (yeah, creepy, I know, but I really was curious on how you're doing), and well, you're doing well in LTA... As expected (Uh. ""Stanford"", if not enough clues to who you are). 

Since then, I've resigned. Perhaps, getting your first choice in life is not as sweet as it seems. A first choice, perhaps, is either a choice out of practicality, or an over- glorified piece of white bread. Nevertheless, it is the interest to tinker, and play with things, that will drive me to carry on with that over-glorified white bread. I mean, f you're bored, you just need to spread kaya, or put meat on it, right?

I suppose, that I am writing this, to a person whom it will never reach, to that person who doesn't remember who I am anymore, as a form of closure bah. I am writing this, because I need to let go, to become more mature, to make space for compensate for the lost time I spent pining for the many others who never once looked back no matter how much I wished and prayed, to grow.

I realise now, that even if I meet you today, at this time, you won't be able to recognise me. I will not know what to say to you any more.

Hahas, but either way, ehh, 欠扁 girl, the world is big, I don't suppose I'd need to tell a person who travels more than me, but as my family always says, 有缘再相见. If fate allows it, may we meet again."
58207,"Does anyone believe it when a girl says she eats a lot but never grows fat? I personally know someone exactly like this. 

During lunch, I sit beside her and she eats one plate of duck rice, one bowl of prawn noodles and one big bubble tea right in front of my eyes. When we buy bread from BreadTalk, she eats 7 breads for lunch and I eat only 1. 

She never leaves anything behind. She always say she very very hungry all the time. She never goes to the toilet to vomit. 

Yet, she is quite slim . I wonder how she does it. She is not lying because she really eats so much. Does any medical professional know how come really got people eat so much but still so skinny? "
58206,"I would like to confess anonymously that I really didn’t cry when I heard of Aloysius Pang’s death, because I totally didn’t even know his name and face and existence prior to the incident. I really don’t know who he was and I never seen him act before so it’s the same as another complete stranger dying. 

I am sorry, I really didn’t cry at all. 

And since this is anonymous, can I also confess that nothing in my 21 years of existence has made me cry? My grades are around C + and B minus but I never feel sad at all. I don’t care. 

I have watched really sad movies before. I really never cried at all because even if the same thing happens to me, I won’t cry. It’s not like I don’t feel sympathy. 

If my mum die, I also won’t cry. Really. I have watched her fall asleep so many times, and I don’t cry all the way until she wakes up. Dying is the same as sleep what. If she sleep then I let her sleep, cry for what? Dying is you extend longer only, no? 

I am distressed. Social pressures dictate that we cry to appear human and kind. But I don’t even cry if I get C + for all my modules here. I don’t even cry when I fall down. I don’t even cry when I fail my exams in jc. 

How to make myself normal and a good person with emotions? "
58205,In the toilet I always zip my pants after washing my hands. Any guy who does it the other way round is just gross.
58204,"Hi guys, a concerned bf here. Just wanna ask the ladies here for some advice.

Some background: I keep track of my gf's cycle but I realized that it's quite long. Avg about 50 days like that.
When the cycle came, her period only lasted for few days and the volume is minimal.
So, how do yall ladies regulate and maintain a healthy cycle? 

p.s I could have went to google, but I think the female community here will likely to give better advice."
58203,Can fwbs become bf/gf eventually? If possible can someone share their experience be it whether got tgt or not. Would like to know to help me decide if I should accept my fwb who has been chasing me
58202,"Does anyone know if there is any cure or method to stop hives? I have suffered from chronic hives for many years. Antihistamines work for awhile and so i have to take them reularly. But once i stop, the itching and redness comes back. Quite a torture to be itchy and rashes for life. Please don't troll, really need some help."
58201,The barista at med school Jewel Coffee seem to be as nice as her coffee is well made. Don't you peeps think so too?
58200,"Hi all, hoping to be able to seek some medical advice here (:

I'm having a skin condition called chronic urticaria, which is fundamentally different from eczema. I have tried many many ways, including western medicine and TCM. They helped mitigate for a while, like a day or two, then my condition either comes back or worsens. 

My condition used to strike a few times a year since young which will ultimately recover in a day. But this time, it has been bothering me every single day for about 2 years. They are unbearable itches which I often scratched till they bleed, and there are just scars all over my back especially.

This is seriously affecting my life very badly and it affects my self esteem and self confidence as well because I feel that my skin is really ugly with all the scars and all. So if anyone has any advice please please do let me know. Thank you so much in advance (:"
