tag,text
57198,"#57198: To the few people defending the act of reserving seats: 
Allow me state the obvious - You are decreasing the total number of seats while you queue for your food. If no one reserves seats, more seats will be filled with people consuming their meal, and moving off after they are done. It is less likely that there will be a shortage of seats, even though the lunch crowd population is constant each day.

Reserving seats is inconsiderate, and comparing this practice with bad practices from other countries does not make it any less inconsiderate. Any sufficiently large group of humans will have good and bad practices, and correspondingly, good and bad people. I think it is time to get rid of this bad practice."
57196,"Being inclusive is one of the most fundamental forms of respect we can offer to those around us.

Belonging to one of the minority races, I received a rude shock upon entering NUS last year, having last experienced this only in primary school. I thought certain people from the majority race would have outgrown this to become more mature individuals with a good awareness of their surroundings. Unfortunately not so.

Initially, when I had groupmates speaking to each other in Mandarin I did not really take it very seriously, because they were mostly one to one conversations that I was not very keen to get involved in. However, during committee discussions when I was the only minority present, nearly half the discussions took place in Chinese. 

Of course I did think of reminding them of the presence of a non-Chinese. Amidst the boisterous chattering (all in Mandarin), however, I felt small. I hesitated, believing that my tiny voice would go unheard among the laughs and giggles. 

I do see that this is not done with racist intentions. I understand that certain parts of speech or humor can be conveyed more accurately and intensely in Mandarin as compared to English, because I experience it with my own mother tongue as well. But at the expense of offending others??

I am not saying that people should not speak in Chinese before me. But it would be respectful to just TRY to translate, if not, a simple apology would do as it shows us that you recognise and respect our presence. Is that so hard??

I am glad that I have not really experienced this from people within my major itself, but it is something that I suppose should be changed. Maybe it is not of much importance to the majority race since some of you may not even have experienced it. But it will definitely bring more joy to us, minorities."
57194,Please tell me when i can obtain funds to organize some sch events such as giving out  green balloons for free to people who are single and ready to mingle. Isnt this more straightforward and better?
57192,"To #57192

Life has a way of making people suffer for the weirdest of things. What was supposed to bring joy and support, ended up turning into something that brought pain and emotional turmoil.

It sucks more that we are the ones that have to suffer the brunt of it.  I hope you're coping well. Or at least better than I am. While it pains to have this barrier, it's something I have to agree with you. We do need this. The constant suffocation was doing us both dirty and it's hightime we both did something about it. I don't deny the bitterness though. 

Hopefully, we can get over this stupid wall we've built for ourselves and come back stronger.

Till then, 
Stay sane space cadet"
57191,there’s this very cute guy with blond hair and good fashion sense in computing canteen  can I find out what scent you use? stood behind you at the drinks store and you smelt so good haha (don’t worry I have a bf)
57190,"Hi. Just curious. For the gays in school, OK this gets a bit weird and sensitive so don't read on if you are anti lgbt. Any of you can share how y'all make friends or find a partner in school or outside? "
57188,"Pardon me, my example is using the average Singaporean male as an example, but the same can be applied to females as well.

Given that:
- the average life expectancy is around 81 years old for males
- Singaporean males generally start working at around age 24
- the CPF contribution rate is around 32%

The average Singaporean male would work for 41 years until retirement at age 65.

Assuming that annual income is about 48,000, without any increment or bonus.
- Someone working 41 years would make around 1,968,000.
- Total CPF contribution would be around 629,760.

Now, assuming zero interest rate, and ignoring changing CPF contribution rate, and one spends all income earned excluding CPF.
- One would spend about 1,338,240 over 41 years; which is about 32,640 per year.

Assuming at retirement, someone spends 32,640 per year.
- CPF should be enough to cover at least 629,760 / 32,640 = 19 years.

If the CPF monthly payout age is at 65, the age when your CPF runs out of money is 84 years old.
Even without including interest, this is 3 years above the average life expectancy.

-------------

Note that my calculations are not overly optimistic or pessimistic, for example:
- You can use X as annual income (I used 4,000 a month as average).
  - As long as you are spending within your means, you are OK.

- CPF has a default 2.5% annual interest rate.
  - Using the example above, at the end of 41 years, the total amount in CPF would be around 1,088,648.
  - Or, in terms of years, you would be able to pay for 33 years of expenditure.

- By retirement, you should be able to own your HDB flat.
  - Thus, you would probably spend less after retirement.

Conclusion: there is no reason to increase the CPF payout age."
57187,"What to do when u see through ppl's lie? Tell them or just go along with it? Honestly, it's probably just something trivial, not anything like pregnancy or that kind of shit."
57185,Is it creepy for a guy to approach a girl although they dk each other in any way? Such as during lecture or tutorial(nt in the same grp)
57184,"Yesterday morning I saw something truly terrifying. A guy riding an e-scooter slipped and fell near the CLB bus stop, and it sounded pretty bad given that I could hear it all the way from the IT bus stop opposite.

No, that wasn't the terrifying thing - no one in the immediate vicinity bothered to help him up or even ask him if he was okay. They all just kept staring while walking away, some even just ignored him and went back to staring at their phones while waiting for the bus. Truly terrifying. 

#NUSboleh"
57183,"Can anyone even think of a single reason for the need to change from IVLE to LumiNUS?

LumiNUS is seriously pissing me off. "
57182,"How do I get closer to my friends in class? Just met a bunch of people that seem really friendly today, and they look very approachable. But I cannot tell if they are genuine yet"
57181,"Saw this cute girl in a white top today sitting alone during lecture. Was so tempted to make a move and sit beside her but that would put me in between her and some other guy... and given that the LT was pretty empty, that would have been rather creepy.

A few minutes later her boyfriend walks into lecture and takes that spot there. There goes my perfectly planned conversation starter during lecture break...
Some guys get all the luck in the world. Ahhh if only I was the guy....
"
57178,"Hi did anyone from LSM2232 (Genes, Genome and Biomedical implications) leave a metal fountain pen in the LT? (Especially if you wore a bright red shirt, denim shorts and left before the end of lecture). Please comment on this post so that I can make the necessary arrangements to return it to you"
57177,Hmm is it too early for a Y1S2 student to join the upcoming Career Fest? Wonder if it would be hard to network with the lack of knowledge/exposure to other core modules.
57176,We are being forced to use lousy luminus. And now the library is reducing their opening hours. Does that mean lowered school fees? 
57175,"Dear Prof Ben Leong,
How about embracing and tolerating slower learners who need to watch the same webcast 2-3 times before understanding concepts? Especially for CS2106(one of the harder 2k CS Mods)
"
57174,"Don't you wish the person who did you wrong (cheated on you, bled you dry, abused you emotionally, physically, etc) gets his comeuppance one day and you will be there to see it? Honestly, this is neither a good or healthy thought but why should he get away scot-free while playing the whole ""good boy"" look to attract girls."
57173,How do you guys find jobs? Do you apply and spam those you met the criteria or only apply for those that interest you? Just having a feel of the ground.
57170,Wanted to take a LOA for the last sem of my studies due to burnout but i am scared if I would have no friends left when I come back... What should I do?
57169,"Hi GET1018 (the Mathematics of Games) coursemates, is it just me or is there no lecture notes and webcasts available on IVLE? Just came back from overseas and want to catch up on the stuffs I have missed."
57168,Do CS2030 labs usually end by 1hr 40min? Is there enough time for travel to somewhere far like FoS? Thanks! 
57165,"#57147 I attended Yonsei last summer and I'd say go for it as there are many mappable core mods and it's opposite the sinchon/ewha shopping district too! If you're in engine tho, I'd suggest Hanyang instead for the mapping of mods, tho it seems like 70% of the student population there will be Singaporeans "
57162,"Did anyone lose their wacom stylus @ UTown Audi 2 during CS2040 lecture (1100 to 1200?)

Please contact me at backupsforphonenotes@gmail.com

(please don't mind the weird email haha, it's the only one of my extras that is anonymous)"
57161,"I know about the guy who is always disrupting CS lectures since last sem. To be honest, I actually enjoy seeing him in lectures because the things he says always make most people in the lecture hall laugh. Trust me, after a long semester it's these funny moments that will keep you motivated to continue to go for those boring CS lectures. So learn to stop hating on him and instead think about the occasional laughters that you get in those lectures and you will actually look forward to seeing him in lectures."
57160,"Hi Foong Wei Han Amos, found your ezlink card on the floor. Will be handing it over to students services centre by the end of today  "
57157,has anyone got their appeals accepted or rejected yet? how long does it take for them to reply? will they reply you if your appeal is unsuccessful? i'm in the midst of planning my tutorial timings and this is causing me anxiety
57156,"I have a guy close friend who is interested in my close friend (a girl) after a meetup where I introduced both parties. 

My close friend (a shy & quieter personality & more introvert compared to me) told me that my guy friend started to dm her and chatting up w her since a few days ago.. The chat also involves some confession from the guy. 

The news gave me quite a shock because they didn't converse much during their meet up.. 

Now, any insights or advice or suggestions? 
1) Is that how guys work? Love at first sight? I've known the guy for a few years & I think that he would take r/s slowly but turn out he's confessing to someone whom he barely knows 

2) How am I supposed to feel or do? Am I supposed to be the busybody OR being chill abt everything? I'm still digesting the whole situation & trying to figure out what I'm feeling abt the whole incident "
57155,"The other side of the story #56983- 
It's true people catch feelings for another person while currently being attached. But have you ever been the bf/gf who completely trusts your partner, actively tries working on the relationship because you love them and yet, are kept in the dark by the same person you trusted and valued so much. This is even worse when your partner catches feelings for someone in your close friend circle and neither of them tell you anything. You find out the truth in the worst way possible- you find out that your friend had even proposed to your partner from other friends.

Well, this was me. I know it's understandable that people catch feelings for another while currently being attached. But my request to these people is that, if you respect your partner even a little bit and value their emotions, please open up to them. It's hard enough as it is to hear your partner likes someone else, but to find out about this from other people, it gets much more difficult to move on.

Recently found out that one of my close friends proposed to my gf and that she likes him and was leading him on. Seems like my whole world is crumbling down. Is it possible to move on?
"
57154,"In the beginning, CIT said ""Let there be light"" and IVLE became LumiNUS. CIT saw that it was good.

On the second day, CIT said ""Let's make students do unnecessary labour."" So they include an auto-logout feature and saw that it was good.

On the third day, CIT said ""Let's remind students that they should not rest."" So CIT created a panel to constantly remind them that their next class is waiting for them and saw that it was good.

On the fourth day, CIT said ""Let's warn students that their days are numbered."" So CIT created a countdown to exam which begins from Week 0 and saw that it was good.

On the fifth day, CIT said ""Let's teach students the art of trial-and-error."" So they took away the feature which displays all the files in the Workbin, forcing students to access every folder just to find a file. CIT saw that it was good.

On the sixth day, CIT said ""Let's put a little.... OOPS!"" *knockover a bottle labelled 'LAG'* And CIT saw that it was very good.

On the seventh day, CIT removed any feedback platform so that they will be undisturbed from their rest."
57150,"Are pretty boys generally considered more attractive than ""manly/rugged"" guys in SG or Asia in general? What do yall think? "
57149,"What irks me the most is when people tell you they are ""poor"" when they can afford to have birthday parties, parents can afford a car, can afford to sneak portable aircon into room.

But you on the other hand - you have to watch all your spending for the week, cook the same boring meals to minimise costs incurred, avoid participating in too much student life activities because you need to work and study to get good grades. All these is done because you know that your family - residing in a cramped rental flat somewhere in an infamous part of singapore - is relying on you to do well.

Of course, many people have different definitions of ""poor"" and maybe in their minds they fit the criteria. Yet, these people - knowingly or unknowingly - take advantage of you. Wasting your resources thinking that it is shared. As much as I would want to share my things, please understand that I am heavily reliant on these things and because of the need to be frugal, I only buy enough for myself.

Your privilege and my underprivilege are merely accidents of birth so I will not fault you for having it easier (easier, not necessarily easy). However, understand then that not everyone is equally blessed."
57147,"#57147 I attended Yonsei last summer and I'd say go for it as there are many mappable core mods and it's opposite the sinchon/ewha shopping district too! If you're in engine tho, I'd suggest Hanyang instead for the mapping of mods, tho it seems like 70% of the student population there will be Singaporeans "
57146,"To OP #57107

Successful friends are not 'useful' because they are not meant to be 'used'. I hope you are not measuring friends up to how much they achieve in their life, but by their kindness and compassion towards others.

It is perfectly alright to have negative feelings or to reveal your desires. Why do you feel the need to hide them? It may be unhealthy to experience resentment every day, but it is less tiring than to put up a fake image in front of other people. 

Be ambitious, not for self interest for but those who are in need. You will find a lot more joy and aoppreciation in life that way. "
57144,Please use https://nuscast.ap.panopto.com/ to access webcasts. It loads faster for some reason. 
57143,"Hello. Any students going for exchange to university of applied sciences, Esslingen in 19/20 semester 2? "
57142,"How can I tell if the guy in my class is attached?

It's only the first session but I think I'd like to get to know him better? He seems to be well-acquainted with the professor, would it be a good idea to stay back after class to ""talk"" to the professor and then find an excuse to talk to him afterwards?

It's my last year here and I guess it's time to start making some choices that go out of my comfort zone...
"
57141,"sigh I have a crush on this guy and I am not sure if he feels the same? we were working part time during the holidays.... really thick skin but I felt something from him... but I have the tendency to overthink such things and I may be wrong yet again. 
But before he left he said something about wanting to ask me and another friend out to have a meal or something... but then until now he hasn’t said anything. I know I should probably just ask him out if I really want to see him but I am a very wimpy person and I don’t think I have the guts to ask him out... aiya maybe after the job he met some better girl and forget about me liao sigh. The way I handle this kind of thing I guess I will forever be alone."
57139,"Does anyone know if we can still apply for CVWO if we missed the homework deadline? Also, is there any other homework/stuff we can work on instead? Thanks! "
57137,"I need some help!

My own core elective changed timing and clashes with my language mod. I appealed through cors to change the lecture timing for the language mod and I was wondering how long would it take for my appeal to be processed? Is there anyone I can contact to expedite the process? Do you think my appeal would be successful? Advice would be greatly appreciated!"
57136,"Hello, I am looking to buy LAM1201 Malay 1 textbook. Anyone interested to sell, please leave a comment below and I'll PM you. Thank you :-)"
57135,"#57125 The question is how people with this level of mental issues passed the medical checkup before entering university? Maybe you would like to see what happened in CS2106, it was far worse than what happened in CS2100, maybe prof Ravi was better at handling him, but his comments are really uncalled for and unnecessary. The fact that because of him we get distracted on top of not having webcast(not sure why it is the case this semester when previous semester had webcast) is not helping either."
57134,"I don't understand why people would bother attending (no-attendance-taken and WEBCASTED) lectures when they just spend the whole time discussing where to eat for lunch, what they're gonna do after school, what bubble tea to buy, etc, making it difficult for other students to concentrate? Every few minutes someone has to go ""shhh"", it makes me feel like I'm in primary school.

The most precious part is when these people get up at the end of lecture and exclaim to their friends that they don't understand wtf the lecture is about. Yeah, no shit.

Please, if you don't bother listening, at least shut up and let others listen. If the lecturer is boring go and feedback or get out, no one's forcing you to sit-in. "
57133,its so sad that im sick for the first week of the sem and i had missed so many lectures. does anyone have lecture voice recordings for pl2131 and dont mind sending it to me? pls leave a comment and i will let you know my email address. TIA kind soul!
57131,"I’m also graduating very very soon, and not got a boyfriend. I really think it’s because I’m not straight that’s why I can’t find a partner easily in Nus, and I refuse to admit this fact because of my family and friends. Not ready for this yet"
57129,"To #57129:

It's probably me you're referring to. All you say is true; Friendships shouldn't be more draining than it is nourishing for both parties.

Nobody knows the predicament we face better than we do. I believe it's best we distanced ourselves for now. At least until we get our shit together. Maybe then can I promise you that unwavering happiness I once gave.

Until then, 
Stay safe out there. "
57128,Hey Hey it's 2019 can somebody please get serious about LumiNUS? Rushing a beta and throwing all webcasts on it when it's still not hanging and lagging is a BIG RED FLAG aite? It ain't right paying 36k school fees a sem for incompetencies like this and what's more most of our school fees are paid by taxpayers money. Can NUS be as professional as what it is supposed to be like? 
57127,"There is this guy that is super good looking, buff and nice. But he quit anti-social and hard to talk to. Any advice please?"
57126,"I am currently a local exchange student at NUS. I am taking 4 modules this semester. In the event that I get an A for all of them, am I still eligible for the Dean's List despite being an exchange student?"
57125,"#57125 The question is how people with this level of mental issues passed the medical checkup before entering university? Maybe you would like to see what happened in CS2106, it was far worse than what happened in CS2100, maybe prof Ravi was better at handling him, but his comments are really uncalled for and unnecessary. The fact that because of him we get distracted on top of not having webcast(not sure why it is the case this semester when previous semester had webcast) is not helping either."
57124,"To #57100:

LSM2191 is see luck. If your TA is very strict in marking reports, you die (Strict in comparison to other groups). I remember when I took the module, there was a TA who failed half of her group for report 1. No give chance at all. Some TA are more lenient and will help us tackle those questions in the practical notes such that we can at least pass or if we give valid reasons that are logical despite lousy lab results, we can still get good grades. 

And one more thing to note, it doesn't matter what your senior wrote wor; it is best to check with your TA what he/she wants. Sometimes, they are looking for certain specifics and things they goes through during class, that are those answers that should at least be in the report. If you only wrote from senior's report and miss out those points, you aren't gonna do well.

Then again, if your TA can't teach properly or forget to go through some stuff, you die. So see luck and pray hard. Quite a fun module to do. 
"
57123,"I am seriously very angry at how unstable luminus is. It takes forever to load, and sometimes when it finally loads it's just a blank page. So much for NUS having such a high ranking if their systems are so trash. "
57120,This girl keep hanging out with me after she broke up for a month. Am I a rebound? What should I when she tells me she's sad over her ex? Do I pull out? Help pls
57116,"CS2106 should be webcasted because of that troublemaker. That way, we don't have to sit through the disruptions while also seeing him in a good light for providing us the service. All the lectures with him around were all previously webcasted and it should be the case for CS2106 too."
57115,"Have anyone been through a situation when someone don't like you for something, and you don't like them even more for doing the same thing.

It is like going for an interview only for the interviewer to tell you that you that they actually wanted someone from another course, in which they shouldn't even have invited you for an interview.

You had many more interviews coming up and didn't want to waste your time travelling to a company for a failed interview

Here is the problem: I thought that this girl was lonely as she always sat alone, so I sent her a Facebook friend request, then she blocked me. 

If she felt offended that I tried to add her, I felt even more offended that she blocked me. There are so many girls more attractive than her, and I have no intention of hitting on her. I just thought that she was lonely. If I knew that she was such arrogant girl, I wouldn't even have sent her a Facebook friend request. No wonder she is always sitting alone."
57113,"Any other management major here? I find it so difficult to bid for modules, the number of modules offered is so limited and somehow I am always outbid terribly. At this rate, I am not even sure I can graduate on time since I couldn't even get the module that acts as the pre-requisite module for many other modules. Hopefully, they can accept my appeal since I literally have no other choices."
57112,"A friend of mine has recently completed another milestone in his life. Seeing him stepping down as captain reminded me of the time when he completed his time as captain for our team, years ago.

Some people treat it as a job. Some got thrown the responsibility. Some get it done. Some don't.
And then there is him. Who goes the extra mile, who goes far and beyond. 
It's not to say he is the best out there. But he is the best I have seen. & I have seen plenty. People like him are a rare species, a different breed. 

One that knows his team better than anyone. One that is constantly busy, doing work continuously. One that does the thankless job no one will do. One that knows the right thing to say at the right time. One that has more passion and drive, and love for the sport than anyone I have ever known. 
We never got to say it then. We will say it now. From your old team of misfits - Thank you, Cap. 

Good job, K. Take a break. You earned it. "
57111,"I'm trying to sell my used textbooks on Carousell, but it is becoming more difficult to sell them compared to the past few semesters. I understand that people would definitely prefer cheaper (2nd hand) electronic textbooks so I have lowered my price by a lot... Does anyone know if there are other platforms than Carousell where I can sell my textbooks? Thanks. "
