tag,text
60696,"Follow up to #60649, thanks for the advice, I saw A again today but I think he took the hint and avoided me. So I guess I'm grateful for the consideration here and I guess there's no longer much of an issue.

I've thought it over and decided that it would be good to talk to my bf about it, and so I'll be doing that and we'll see how things go.

While I can understand that you don't want to know anyone else that's had sex with your partner, I don't think that it's reasonable not to even talk about sex at all and flip out whenever it comes up. I mean anytime it comes up, not even talking about our pasts.

I can't even tell him that he's terrible in bed and that I never actually get to finish because he's so aggressive against the topic."
60695,"I will be entering FASS soon, but I have not made up my mind with regards to which particular major I want to pursue. The ones that I am considering right now are Economics, Psychology, Communications and New Media, as well as Geography. 

Economics is the one I was initially leaning towards the most, as I developed great interest in it ever since picking it up in JC. The concepts, theories, and general essay writing were all relatively easy for me to grasp and I was able to consistently do well in JC. However, I have read about how Economics in Uni places much more emphasis on the mathematical / statistics aspect of things, which worries me as Math has always been one of my weakest subjects since young. 

With regards to Psychology, I've also found out that many people blindly dive into pursuing this major without truly understanding what it entails. Yet, my current impression of Psychology still places it as one of the top few majors that I have interest in. Many also claim that a Psychology degree on its own is useless, as Psychology is a case of ""Do the Masters, or don't do it at all'. Could anyone kindly explain this statement?

I am still in the process of finding out more information about CNM and Geography, so any advice or feedback from both current and graduated students are welcome and will be appreciated!



"
60692,The short-sightedness of people complaining about the straw ban makes me lose a little more faith in humanity each time(and in our ability to avoid catastrophic environmental collapse). And these are supposedly the “more educated” and socially conscious people already.
60691,"Reply to #60652

An individual will naturally have bias for or against a particular issue due to one’s upbringing and socialisation, which starts the moment you’re born. What’s important I feel is to analyse both sides of the argument. It is supposed to challenge your ""common sense"".

Perhaps these claims you mentioned are more of these individuals speaking from lived experiences? They play a part in forming one’s perceptions. It could also be stereotypes or dominant discourse. It may not necessarily be the ""truth"" but the fact that they exist must reflect the situation in a particular segment of society. But then again, there's no such thing as a definite ""truth"" or ""reality"". Of course proper research would have to be done if you’re writing a research paper but when you’re doing in-class discussions and seminars, I would think lived experiences are the more readily accessible area of knowledge.

Higher barriers to entry? Perhaps it is the pessimist/conspiracy theorist in me but that’s highly unlikely. As mentioned by another, FASS in general dabbles in issues that can be subversive. Making the entry barriers higher may send the message that it is a desirable course. More people will want to pursue it and more may even end up starting to question the establishment. Probably not what any state would want. Wouldn’t be surprised if that’s one of the reason why the arts and humanities are not provided funding as high as those of STEM.
"
60689,"Hi prospective NUS freshman here! So I am utterly lost in the application process of securing a spot in the Halls of Residence, Raffles Hall. I would like to know what is the process like from start to end. Before you call me lazy, I've navigated to this page:
http://nus.edu.sg/osa/raffleshall/admissions/application-process
And am simply either lead to a 404 or left to remain on the page. So anyone in Raffles, could you offer some advice on the following -
1. How to get started
2. What's the criteria for selection?
3. When/ how will I know if I get selected.

Thanks in advance."
60687,Hello! I just lost a Black Bose Soundsport Earphones yesterday in CBLC @ Science and I was hoping to reach out for assistance. I've filed a lost and found report via the NUS page. Thanks! If I don't find it I'll always have an excuse to be lazy and not run. My IPPT deadline is coming up i need help!
60685,"I am sorry you have to enjoy your drink without a straw. Life must be so difficult.
But many of us are trying to protect the environment and every little bit counts. 
I am proud NUS said no to straws."
60683,"Why do ""some"" profs delay releasing mid-term marks(It's been three weeks since midterm)? Especially when it is just a multiple choice paper. It is not serving the purpose of continual assessments, where the students can learn from the mistake or maybe start afresh for the next half of the semester."
60682,"I'm a final year student who's having a hard time finding a job. does anyone know when is the ""appropriate""/""average"" time for fresh grads to start on a new job? not sure if some employers are not getting back because i indicated that i can only start in July (it was a compulsory field in the application)... "
60681,"Year 1 student here. I understand that the list of free software are available here <-- https://nusit.nus.edu.sg/services/software_and_os/software/software-student/ --> ? I have matlab, 365, autocad & minitab which is included, but also have others like mendeley and tableau which isn't. This leads me to think are there other free software accessible to students, like adobe cc."
60680,"Human beings are a load of irony.
We like to be around people who have it all and yet act like they don't (some call it being humble).
We also like to denounce people who don't have it but try very hard for it (some call it faking it).
Hence, to everyone trying to please another human being to get into his or her good books, stop it. 
If you don't meet the cut (someone else's expectations), cutting it won't help.
If you are the right cutting, you really don't have to cut it."
60679,I suspect that my recent interview went well. I have a feeling that I will be invited into a 2nd round soon. Can anyone tell me what are some signs an interview went well?
60678,Hi is there anyone who went for the NUS scholarship interview before willing to share how the interview process was?
60676,"OP of #46692 here. For those who are lazy to click, here's what I posted last time:

""Had a secondary school gathering the other day met the girl who was my first love. After the gathering we shared a cab home since we live around the same area. 

The short 20 min ride was an emotional rollercoaster (no pun intended) for me. It reminded me of the reason why I was completely attracted to her back then. At the same time it reminded me of why we didn't, and would never have worked out.

We're still on talking terms and in fact is planning for a trip for this group of secondary school friends at the end of the year. But I guess that bittersweet feeling I get when I'm around her would never go away. ""

During the trip, there was this moment when two of us were alone. Somehow the conversation topic came to our past relationship, how we got together, how we broke up etc. It was then I asked : 

""Would we have worked out if both of us were more mature?""

She didn't reply at the moment. And I decided not to pursue the topic.

At the end of the trip we shared a cab home from the airport again since we live in the same area. We didn't talk much during the ride. Just when she's about to alight she said: 

""I guess we'll never know unless we try.""

Fast forward a couple of months to today: We are happily attached and the appears to be going strong.  Idk how far we'll go this time. I'm just grateful that we're given a second chance. I'll treasure this and hopefully take her down the aisle this time. 

For all those troubled by love out there: Not everyone will get a second chance like us. If you really love your other half, treasure them. "
60674,"I'm a relatively fresh NUS graduate, just wanted to ask what's the opinion on dating an intern at the workplace?

Just to give some context (and keeping it deliberately vague for obvious reasons), my company hires interns from NUS on quite a frequent basis. In all honestly, I wasn't really looking for anything, and in fact I treat most of them as friends only. However, there's this particular intern who slowly grew on me; maybe it's because of common topics as we had the same major, or just her friendly demeanor, or that she's super capable, or that she looks so cute when she smiles, idk. Anyway I feel like I'm falling for her bit by bit. Biggest problem is that I don't know if it's even appropriate, and I don't want to be seen as the creep/fucboi who preys on interns, though our age gap isn't that big (I'm still a fresh grad after all). Somehow I get this guilty conscience / conflict of interest feeling as after all, I am still sort of her ""superior"", and I don't want any misunderstanding to arise from all this.

Am still trying to stay as detached as I can so I don't crash too badly if things don't work out, but does anyone have any advice? Or perhaps used to be in the same situation?
"
60673,"Hi guys I need some advice.

I have recently graduated last year (overloaded to grad 1 sem early), with a second upper in comms, and now am working with a friend on a startup earning about 2K a month. I know it's very little considering what I can earn outside doing a 9-5 desk job, but I am passionate about the business, and don't mind the long working hours hustling to grow it.

I'm in a dilemma right now, and am very very stressed out because of the pressure from my parents who are expecting me to earn 3K+ and collecting CPF with my degree. As the company is still very small, it is unable to pay me what outside companies can offer, but should it grow, I know I will definitely be the first to be given my dues, considering I'm part of the founding team (aka as the company earns more, I will get paid more).

The dilemma is then, should I take the conventional, safe route of graduating > getting a comfortable 9-5 job which I might not enjoy as much as what I'm doing now, OR should I chase my dreams and take the high risk/high reward, unconventional route of entrepreneurship and continue grinding at the company?

As with most entrepreneurial journeys/startups, success is not certain and I'm aware of that, hence r'now I'm in a limbo of whether it is worth it to take the leap of faith and try to see if it works out, or just go and start finding a job pronto and not waste anymore time. I'm a female, 23 this year, if that matters. Some of you guys' insights would be greatly appreciated!! Thank you"
60671,"#60610 here

Hey Prof Ben, sorry if it came across that way but I didn't mean to say you were elitist and I probably should have phrased it differently. Didn't mean to be rude or anything. I think it's that you remind us regularly that the job market as of today is still quite elitist in nature (at least for first jobs) and the motivations behind it, when many profs in my course (I'm not in CS but in a fluffier subject) like to downplay its importance which is a real source of frustration. This is especially ironic when they always say they will use the bell curve. It's always the essays which I've struggled with scoring, the mods where it's a set answer I've done much better. You know I wish my profs would release the solutions so I knew where I went wrong, but that hasn't happened.

Again, I hope you understand from the post that I actually agree with the fact that you say what needs to be said and treat us like young adults instead of kids which need coddling. University should be a time where students grow up, maybe you could say grades are not the only thing and there are other things which matter true, but downplaying it's importance just to make students feel better doesn't fix anything. Going to a consult only to hear that the score doesn't suck doesn't fix anything. A spade is a spade. When you ask, what you want to know is what you missed and what was expected which led to your score so that you don't suck the next time, that's way more important.

I didn't expect such a long response tbh, but I've read it and this sincere piece of advice, I'll take it. I generally agree with most of what you said, but I do have this to say, I think everyone compares upwards generally because that's where we want to end up to be answerable to ourselves and our loved ones. Knowing yourself to be fortunate is one thing, but using that as an excuse to lose one's drive and cave into self-consolation gets us nowhere. There are many kids who want to get into uni but don't on their first try, but they don't just take that no for an answer. They strive and work hard in what they do, eager to prove themselves, some of them coming in as mature candidates while others work their way up into their careers to prove that they've got what it takes to succeed. That's what we should be inspiring, instead of saying because you're in nus you're exceptional because you're the best. Frankly, this sort of behaviour not only reinforces societal stereotypes against non-uni kids, but can make those in uni develop complacency and a sense of entitlement. 

Lastly, I think your idea of pushing for mastery over a one time test is really ambitious, and even though I may not directly benefit from this change since I'm not in CS, I wish you and your team all the best in getting these tough but necessary reforms passed and hope it catches on across the entire university. It's exciting to have such a deep exchange of views, and I hope there aren't any hard feelings and I sincerely apologise if there was anything I said that was personally offensive in any way, but I'll be blunt this talk about 'exceptional because you're here' needs to stop."
60670,"Hi, came across the remark left by Prof Ben about NUS Geog Department being one of the best department. so would like what is the average cap in Geog or FASS in general? "
60668,"I can't get over him. I know I screwed up by cheating on my then bf with him, but I just can't get over him. I'm still seeing him in school, and I've still got years in the same faculty as him. He's always with his gf, he's nice when we meet and we do still talk, but I'm not sure if his gf can tell that we hooked up before or if she's okay with it.

I know I need to cut him off, but I'll maybe nevr be able to do it in the near future? Do I really need to cross the faculty to avoid him whenever I see him?"
60667,"Do you have a strong sense of emptiness after graduation? You have been in the education system for so many many years, blindly chasing after As and suddenly when you graduate, you are scared and have no sense of direction? Also I am single and feel so lonely, especially after seeing some of my uni classmates/friends getting their BTO/getting engaged. I feel so empty and depressed and I do not know how to get better. Tried so many ways like medication, exercises, going out with friends for dinner, drinking at pubs, clubbing... but i dont seem to get better. What is the root cause of this? Anyone feels the same. I am 25, single female, graduated from NUS 2 years ago, employed with a decent salary and I don't hate my job."
60666,"#60666 Not too sure if your post was directed to me (because it sounds like what you would have said). But I just wanted to say, I wish you can find your ultimate happiness, and that you can definitely do so, because I had my happiest moments when I was with you.

Even if I was not the person intended, just wanted to wish you all the best."
60665,"I’m a final year student and I’m facing some issues finding a job (I know, welcome to the world). I’ve indicated on some of my applications that I’ll only be able to start in July (since it’s a compulsory field in some of the applications) and I’m wondering if that’s why some of the employers are not getting back to me.

Does anyone know when is the “right” time to start on a job? People have usually told me July- August was “normal”, but I’m having second thoughts now. "
60661,I feel weird saying this but my crush has been appearing a bit too frequently at places I happen to go to. First of all i told him I have breakfast at this food court place near the place we stay. The very next day I saw him there I have never seen him there in my life. Not sure if he pretended not to see me or he didn’t see me. But I spent a hard time waving at him before he saw me. As he seems to have no intention to want to sit with me. I bravely took my food and just sit down with him and we ate together. The other time is that I am always early for class so I would chill at this spot before class start. One morning I went to the place and I saw him. One of the first few things he said was “I am not stalking you.” It didn’t occur to me that he was stalking me because I was too happy to see him... but may because I appear to be too happy so he said that? Confused....
60658,Are there any lecturers who are good for first year modules? All I hear are complaints about how the teaching staff is terrible.
60657,"There's been lots of discussion about LDRs, so here's my story.

I'm in a LDR with a girl. Thing is, I'm a girl too. Aside from the fact that my love is halfway across the world, our families are homophobic too, which makes things a thousand times more complicated. I'm thinking of visiting her soon, but there's been lots of resistance from my family, and due to financial reasons, she's unable to come to me. She's the love of my life and we're trying so hard to make this work, but it seems to be a difficult feat.

What should I do?"
60655,"Hai. whoever left your silver watch on the utown piano on 25th March evening, please go and collect from utown security office.  "
60654,"I have a suggestion for the bus service, I don't know where to send the suggestion but I'm also lazy to find out and I know that the NUSSU people read NUSWhispers. 

Anyway, if the algorithm isn't already implementing this, I suggest that a new system could take in the timetable of all the students and generate the number of specific bus route needed for each timing. For example, If there are many students with lecture transiting from FOS to CLB at 12 pm, perhaps, the system could send more bus that caters to these students plus minus 30 minutes such as sending more bus A1 (I don't know if its the right bus) from 11.30 am to 12.30 pm. I think that the routes are quite simple within NUS and therefore, I don't think that it is an unreasonable request for the bus drivers to be familiarized with all the routes and to change multiple routes throughout the day. They just have to follow a platform that tells them which route to drive at which timing etc. 

If the current system is already taking this into account then just take it that I am talking nonsense. I'm just a lazy student and don't really feel like digging out the current system of the buses. 

To those who are intending to comment things like ""This is not the right place to suggest"" or something along the line. Honestly, I don't take the bus and I don't really need a revamp in the system, I just feel that many people are complaining and therefore, suggesting some ideas for the welfare of NUS peeps in general. So if you have nothing nice to say, just keep it to yourself. "
60652,"Reply to #60652

An individual will naturally have bias for or against a particular issue due to one’s upbringing and socialisation, which starts the moment you’re born. What’s important I feel is to analyse both sides of the argument. It is supposed to challenge your ""common sense"".

Perhaps these claims you mentioned are more of these individuals speaking from lived experiences? They play a part in forming one’s perceptions. It could also be stereotypes or dominant discourse. It may not necessarily be the ""truth"" but the fact that they exist must reflect the situation in a particular segment of society. But then again, there's no such thing as a definite ""truth"" or ""reality"". Of course proper research would have to be done if you’re writing a research paper but when you’re doing in-class discussions and seminars, I would think lived experiences are the more readily accessible area of knowledge.

Higher barriers to entry? Perhaps it is the pessimist/conspiracy theorist in me but that’s highly unlikely. As mentioned by another, FASS in general dabbles in issues that can be subversive. Making the entry barriers higher may send the message that it is a desirable course. More people will want to pursue it and more may even end up starting to question the establishment. Probably not what any state would want. Wouldn’t be surprised if that’s one of the reason why the arts and humanities are not provided funding as high as those of STEM.
"
60651,This is the third time in FASS a lecturer said they are careful about discussing sensitive topics in the classroom. Do others face the same thing in FASS? Lecturers are careful about what they say in the class. Other students say the same. 
60650,"should i practice coding on hackerrank, leetcode, or kattis, or some other website? or is there not much difference between these sites? thanks in advance 
- coding noob (for now) "
60649,"Follow up to #60649, thanks for the advice, I saw A again today but I think he took the hint and avoided me. So I guess I'm grateful for the consideration here and I guess there's no longer much of an issue.

I've thought it over and decided that it would be good to talk to my bf about it, and so I'll be doing that and we'll see how things go.

While I can understand that you don't want to know anyone else that's had sex with your partner, I don't think that it's reasonable not to even talk about sex at all and flip out whenever it comes up. I mean anytime it comes up, not even talking about our pasts.

I can't even tell him that he's terrible in bed and that I never actually get to finish because he's so aggressive against the topic."
60645,"I have a friend, whom didnt do well for A levels, then went on to poly and is about to graduate with a cgpa of 3.72. So total he would have spend about 6 years in his tertiary education. Becos his family is poor, his parents does not have the resources to send him overseas to study. He is currently 25 years old. Now, he at least has a fighting chance to secure a local uni placing, something which remains as a dream for many others. 

He told me his journey was tough. Most common criticism he received was why devote so much of his life in education,when he should just move on in other aspects of life like working and find himself a girlfriend to settle down.

He says that major aspects of life like settling down is destiny and forcing oneself to settle down will bring nothing but disaster. Also,because he only had an A level cert, he could not find a job with proper prospect as well. Hence, his decision to go poly.

As a nus student myself, i appreciate how hard is it to secure a local uni placing in Sg. Hence,by  looking at his results, i really think his journey was worth it. However i wonder,  god forbid, if our juniors were to ever fall into in his position, should they also repeat his footsteps? What are your inputs?







"
60644,"
I feel that the use of words like ""entrepreneurship"" or ""start-ups"" have been very highly abused lately.  

Ask left, he tell me is a entrepreneur. Look right, another group tells me they have a start up company. However the funny thing is, both party's business model is to help others start up a company/business, when both parties themselves have no prior experience in running a business.((red flag!!))

Also by looking at their igstory, i see them partying most of their nights away in zouk or siamdiu outlets. ((Nothing wrong la actually))

But i still cant help but to ponder: 
if you yourselves do not have any prior experience in running a business, how can you help others to build their start up? through constantly partying in zouk or siamdiu??






"
60642,"Honestly, I hope that whichever official NUS organisation is responsible for banning plastic straws will lift it. I as a plastic straw user do not force those who do not want to use metal straws or no straws at all to use them. Both drinking from a cut seal and paper straw is disgusting. Call me pampered if you like but the former generally results in some drink getting on the outside of the cup while the latter just adds a weird off-putting cardboard taste in your drink. Given such ""strong"" support from NUS to remove these straws I suggest bring them back and see how much usage has actually dropped from these forced measures. All this is doing is pissing off and converting previously neutral consumers. NUS wouldn't be the institution it is without the many thousands of students that study here and such changes which impact almost every single person could be done more democratically I feel? Granted this is not a big issue of life and death but the fact of the matter is that it does affect the entire school population. Would really like to hear the general view of you guys out there."
