tag,text
54309,"#54309 Who say guys do not have such freedom in dressing, i wear fbt shorts on most days to school unless I have lab and presentation. I have even worn skirt and dress before at home but not in public yet. My fbt shorts are so short that it is a close fight with the girls. I have experienced numerous curious stares and even experience harassment once where a random guy suddenly yelled ""nice and sexy butt you have today!"" I just take it as a compliment that I have such great body. In fact, my butt dont look sexy just today, it looks sexy everyday. A real man does not need to use violence against such people, dress manly or be buff, a real man needs to be confident of his body and ignore what others judge as long as you feel comfortable in it. If you see someone in a super short fbt shorts in school, most likely is me, feel free to pop by to say hi. "
54308,#54254 did you notice how no one actually bothered to answer your question but instead nitpicked nonsense about birth rate? What a bunch of losers!
54307,"All this complains and rants about the ireduce campaign are rather annoying stupid and shallow, knee jerk at best. It's the epitomy of the idiotic Singaporean mentality of never ending complaining as well as a toxic way of arguing known as ""whataboutism"". ONE STEP AT A TIME LAH. There's room for improvement execution wise for sure, but the spirit is right. Bloody swjs. "
54306,"How accurate/inaccurate is the NUS next bus app? I see a lot of terrible reviews of it, but is it really that bad? "
54305,"I keep wondering why it’s  so tough to make friends in Uni (im from a minority school in my course).... though school has started for 2-3 months (and more with rag) I feel like I still can’t find a Friend whom I can confide to and stuff. 

I do have other good friends but I’m afraid of burdening them with my insecurities since they have their own troubles in their new schools too.... is it just me who’s unable to adapt (especially since we have so much work now and yet still have to cope with friendships.... we have so many more years to go in school and in the workforce next time so I really want to make friends) 

I feel like an awkward turtle with my classmates and often laugh awkwardly around them and I think they feel it.... how should I try to open myself up and make friends, most of my classmates seemed to have no trouble making friends except me :( [maybe all the shy people are webcasting from home :”)] 

- insecure and lonely year 1 student - "
54304,"Currently opting for a second major in Computer Science. However, as I am currently in my third year, I am experiencing some difficulties deciding how to lay out my module plan. 

SOC has just approved of my (tentative) module plan. But personally I'm not sure how strict they are about sticking to this plan given potential clashes due to changes in future timetables. 

If anyone has shared a similar experience please comment below! Thank you"
54303,"
Sometimes I have these relapses where I just get really lonely but I feel I have no one to turn to. I have friends but at most they're quite superficial, like not really that close or anything. Sometimes I think it's just insta screwing me and making me feel bad about my state of mind and such.

I kind of always wanted a gf but I'm just too scared to take the leap. I'm scared to ask people out for like meals or to hang out because of fear that they're too busy or that I'm desperate. (esp for girls) Like it's also really subconscious for me, but I tend to avoid eye contact and interact with pretty girls because I don't feel I deserve to know them or be their friend. Like for me, I just really want to spend time knowing people and just hanging out (and I have the time to) but I'm just too scared to initiate.

It sometimes really confuses me how my mind works. But I just feel that SG is just this really conservative place and everyone is more worried about grades and careers rather than meaningful relationships. And I've just kind of put myself into that position (or dug a hole) where I basically am really desperate to get to know people, to become closer and to have the kind of social life ordinary uni people have. But that in doing so, I'll just start turning people off and breaking the relationships that I want to create.

What should I do?"
54302,"How to respond to someone saying ""I have a crush but ....""

Source: Tonikaku Cawaii by Hata Kenjiro. An author with a penchant for virgin delusion stories (chapter 2.5)"
54301,"Hi all, i'm at an important crossroad and i really need some advice right now. A few months ago, i've started a personal trading portfolio for supplement income to pay my tuition/expenses. Ofc this wasn't entirely a smooth ride, but my rate of returns has stabilized over time. Overall, swing trading has proven to be much more profitable than i expected. I've kept a record of all my trade alerts, transactions and analysis, including some videos that details my thought process on the charts. Recently, I'm started to pool capital from relatives(ofc i do pay them a risk premium) since i now feel more confident with handling larger position sizes.

I understand that trading is highly speculative and has little to do with any one particular academic disciplines. I'm really interested in this field, but I've got no economic background apart from *lol* H2 econs. My major has little to do with macro-economics. Recently, I've started creating an algo-based trade-alert generator/logger based on whatever little i've learnt in my foundation mods, and i'm eager to receive insights from certified experts so that i can eventually develop it into a functional app. Does anyone know of courses or modules in nus that delves into trading or managing hedge funds? And for those who are working in the industry, apart from my personal portfolio, what sort of formal qualifications or experience do i need to secure an internship. Thanks"
54300,is it even possible to get into exchange if my CAP is 3.6? Engin Student here. 
