tag,text
56999,"Hi, does anyone experience this too - I get really anxious and breathless when I find myself squeezed between many people in crowded places (like peak hour mrt cabins). Never really had this problem before but recently I felt myself feeling really uncomfortable when there are so many people just crowding around me. 

Some people can just kind of zone out with music or social media browsing but I really can't even effectively distract myself... 

Is this claustrophobia? Am i just bing paranoid? Just the sight of massively large crowds flooding a certain place is quite unbearable. Less on an emotionally frustrated level but more so, it makes me physically unwell. 

How am I supposed to go out to work 5-6 days a week in the future.... "
56998,"hi i’m an a level kid that applied for nus early admissions. my choices are such: A with double major B, B then A. however now im considering just taking up B. if they give me A w double major B, can i just appeal during the appeal stage? what are the chances of success? also, if i get a nus scholarship before this appeal, would it be affected?"
56997,"Dear RVRC Residents (both exchange and full time),

IDK bout other RCs and halls but... 

PLEASE note that WATER COOLERS are for DRINKING PURPOSES. Filling water to brush your teeth is still tolerable, but several times have I encountered people filling buckets meant for mopping the floor and washing dusty containers meant for storing their things, probably cuz the sink is too small for the buckets and containers.

To the RVRC Management Team, I believe it wouldn't hurt to improve such serious hygiene issue by simply placing a sign around the coolers that ""WATER COOLERS ARE FOR DRINKING PURPOSES ONLY"". The effortless act of putting up a simple sign can prevent UNSUSTAINABLE water-borne diseases from contaminating our water source. (can someone bring this to their attention?)

Admin, this is a serious issue towards the health of residents. Don't censor."
56996,Has anyone taken MA1521 and willing to share their material? Thanks in advance :)!
56995,"I'm graduating after this sem (May 2019) and my cap is borderline 1st class. I've started job applications since December but yet to receive anything. Should I be panicking? Legit question, no trolling pls"
56994,"#56994: that's how my previous relationship ended.

We were together for 3 years and there was a weird period when I have already been working for 2 years while she was just freshly graduated. It was a stressful time for her: not being able to find a job and feeling like a failure. it was rather bad of me not knowing how to assuage my gf's worries. I was rather callous, sarcastic, and uncaring at times. Things started peeling off; over a long period of time. Maybe don't come over to have dinner with her family (it was frequent), maybe ""I want some time alone going places"", etc ... 

Then it's the ""let's take a break from each other"". A month later, breakup. There were tear, drunkenness, bitterness. etc ...

Our relationship had lots of ups and down. We had sex, then we stopped. Why we stopped was because of a stupid argument (my bad). In short, she wanted to do it bareback during her period and I don't. I was a hypochondriac and when I knew she had unprotected sex with her bf, I was reluctant to do the same with her afterwards. I tried to played it as ""it's not that I don't trust you; I don't trust your ex"". it somehow ended as ""OK, let's not do it"" but because we were horny af, we continued with everything else. Thinking back, the frequency of arguments picked up when we stopped the sex.

I learned a lot from that episode and grew from it. How to tone down the sarcasm, general bitterness, and pessimism. How to be supportive and not snap at the first sign of trouble. And how when you start having sex, don't stop. Good thing too, since about 2 months after the breakup, I met my now-wife. It has been a good 4 years, 2 being married."
56993," Hi OP of #56959.

-SMU's Round 2 of bidding is also during the first week of school.
(just saying)"
56992,"Need advise, no trolls please. I’ve been attached for 2 years now and we’re quite happy together. My bf is neither hot nor rich but he is caring and understanding. Like although he only earns about $2k+, he still brings me to movies and dinner dates...treats me to hotel buffets - which can be quite costly like $100 per pax - on special occassions. He gives me time and space when i’m busy prepping for exams or projects. 

However, recently I came to know a girl whom kinda likes me. I think she would be my gf if I were to work on it a little. It would also solve all the questions about my lack of gf and my dream to have children. 

Do you think I should break off with my bf although I really love him? I’m not attracted to the girl but definitely can see myself living with her...."
56991,"#56991: Your Prof clearly doesn't have your best interests at heart. It happened to me too. Most NUS Profs see you as an investment (to train) and therefore do not see any benefit from serving as your referee when you apply for overseas universities. Your My former NUS Prof actually told me I would be better off remaining as his/her technician/RA than doing a PhD abroad. 

Just look for another referee from your undergrad or do another internship.  A good potential PhD supervisor will overlook the lack of a reference from your MSc supervisor, if you have a proper explanation. Keep your head up and don't look back."
56990,"Lately, I’ve been looking up information about my ex online. I keep wanting find out how my ex is doing from other sources. How do I get rid of this habit and start focusing on finding someone new? TBH it’s very hard for me to channel my heart to someone else and also, to concentrate on this new semester"
56989,"In reply to #56980 —

OP of #56959 here; I'm aware of all the problems the other OP listed; that's *exactly* why I said 'albeit with a few caveats'.

My point, however, had nothing to do with NUS having an appeal system, or NUS having tutorial balloting, or SMU not refunding points, etc. For all the accusations that I've committed a logical fallacy, I think OP of #56980 has done the same thing— they have built a straw man. 

I only brought SMU up at the end as an example; my key (and only) point was that NUS' bidding/balloting is scheduled too late, to the extent that it ends well past the start of the semester, and that my personal belief (with incomplete information, of course—I don't work at the Registrar's Office) was that NUS could bring the entire process forward (perhaps starting shortly after results release) without affecting any of CORS' features, like appeals, point refunds, balloting, etc. 

Nevertheless, all this discussion is in vain, because CORS will be scrapped starting the next academic year. I thoroughly expect a mess for at least the next two semesters as teething issues are fixed and the dust settles. 

"
56988,Hello has anyone taken GET1022 Understand your brain before? Tried to look for reviews online but can’t find any. Any seniors can share their experience? Thank you :)
56987,Is it true CORS is gonna be replaced by STARS (NTU system)? I heard there won't be bidding points anymore. I'm a freshie and have spent everything this year.. 
56986,GEH1036 ez mod. Just spend 1 day for midterm and 1/2 days for finals. No need attend tutorials or lectures xD
56983,"The other side of the story #56983- 
It's true people catch feelings for another person while currently being attached. But have you ever been the bf/gf who completely trusts your partner, actively tries working on the relationship because you love them and yet, are kept in the dark by the same person you trusted and valued so much. This is even worse when your partner catches feelings for someone in your close friend circle and neither of them tell you anything. You find out the truth in the worst way possible- you find out that your friend had even proposed to your partner from other friends.

Well, this was me. I know it's understandable that people catch feelings for another while currently being attached. But my request to these people is that, if you respect your partner even a little bit and value their emotions, please open up to them. It's hard enough as it is to hear your partner likes someone else, but to find out about this from other people, it gets much more difficult to move on.

Recently found out that one of my close friends proposed to my gf and that she likes him and was leading him on. Seems like my whole world is crumbling down. Is it possible to move on?
"
56982,"Admins pls dont filter!!!!

CS seniors what are your thoughts on taking cs2030 during special term vs next year sem 1?"
56979,"I want to add on to #56959's rant about the current system. Having round 3 bidding and tutorial balloting happening after school starts just adds unnecessary frustration. 

Module bidding: For students unfortunate to not get what they want within rounds 1 & 2 or those who want to overload, being forced to wait till round 3 is just plain stupid, and it almost feels like you're being neglected by the school just because most people have already got what they need.

Tutorial balloting: After getting our lecture slots, we'll already be going to school and listening to lectures. But then having to deal with the time sensitive add drop swaps during the final round WHILE in school makes it kind of hard to focus in lectures, particularly for those who desparately need it.

Some of these concerns/details may be small, but it's the small things that add up to make NUS a better place for students. And besides it just makes sense to have all the timetables fixed before school starts, is it that hard? "
56976,"I just watched Crazy Rich Asians, and I can't be the only one disgusted by this movie? Many friends seemed to like it, a few even going as far as to tout it as the best movie in 2018 -.-"
56973,i'm planning on overloading and taking GEH1023 but i can only bid for it on 14 jan ... which is also the day of the first lecture at 10 AM :')) can a kind soul please go to ivle and email me the required materials for the first lecture ?? please comment and i'll pm you my email !! please help me out thank you :))
56972,"i came from a broken family. even though my dad is relatively decent to me and my sister but he has been cheating on my mom since forever and they are still married because my mom refuses to give up on him. i have seen photos of him with other women since young and we even found love letters in his drawer... just a few months ago when i went to dig the rubbish to find something that i accidentally threw away i found his credit card bills, showing that he has been to various hotels in sg prolly with prostitutes. i know you guys will probably tell me, it's your parents business that their marriage failed. why am i complaining so much. 
well the thing is. ever since i am aware of what my dad has been doing, i find it difficult to trust guys at all. even when my guy was just talking a bit too much to my friend, i went berserk inside, thinking that he is cheating on me. i tried really hard to convince myself that there is nothing going on, but the thoughts of my dad cheating just keeps coming back to me. it is hard to believe that anyone can love just one person forever. i really just want to trust my guy and not worry about any bitch that starts talking to him but i can't and i don't think it is possible for me to trust anyone at all. this is really unfair because i already suffered so much in childhood and this shit follows me into adulthood and possibly forever..."
56971,"Hi, does anyone know if Get1028 Logic lectures are webcasted?"
56970,"Hi. This is for those wanting to take GEH1036 Living with Mathematics but not concerned with difficulty or bell-curve:
""The objective of this course is to exhibit some simple mathematical ideas that permeate a modern society and to show how a reasonably numerate person can use these ideas in everyday life and, in the process, gain an appreciation of the beauty and power of mathematical ideas. ""
(This is found in CORS or the module description in the math department website)

Looking at the above paragraph, one can infer the module will certainly be easy as long as you know a bit of math. This claim can be corroborated easily by asking whoever has taken the module before. However this module has no preclusion, so anyone can take it. That is if you are willing to pay for it as module quota often fills up quickly.

Reason why I am doing this is that I feel one should not think that this module is not for him/her just because the bell curve is too steep, or it is hard to get a good grade for it. (or any other reason that is similar to what I wrote). Rather, you may want to consider whether you are appreciative of what is taught in the module that shapes the modern society today. I believe this is the primary learning outcome of this module, no different to any other GE module you know of. I'm hoping you want to take modules you are more interested in, and not just getting an easy A on your transcript.

TLDR: Are you interested in the CONTENT of GEH1036? If yes then go ahead and read it. Do not be put off by the bell curve.
"
56967,Hey guys! Was just wondering if it is ever too early to start attending career fests and talks? I'm still quite a long way from graduating but I'm interested in these events.
56966,"Help, during my MPE exercise i didn’t state that I was overloading (doing 24MCs) because I didn’t have the intention then. Would I still be able to bid for another module during round 3 though? I currently have 20MCs already. Otherwise do I have to ‘drop’ one existing module to do so. How does this cors thing work??Thanks!"
56965,"Because of how poorly NUS presents their information on their graduate programmes, I'm went from being keen to pursuing a Masters to not at all entertaining their thought. I've asked the staff so many times and they show me attitude and don't tell me the accurate information or give me contradictory information. They don't put down how special programmes work so by now I've missed the deadline because they vaguely put down when you should apply without specifying what your progress should be by then. You have to look so hard to find out what modules you need to take to qualify.

NUS chases KPIs and has screwed over students so many times in so many areas. At the very least, new universities are opening up and we're more aware of how shitty NUS can be."
56962,It looks like CS2030 added a project component to the already heavy workload this sem. Hopefully the project will be something not too demanding else workload is cut from somewhere else? And I am pretty sure the new workload breakdown does not add up to 10 hours for this 4MC mod. rip CS2030
56961,Anyone realise that there seem to be much more highest distinction people in engineering compare to other school
56959," Hi OP of #56959.

-SMU's Round 2 of bidding is also during the first week of school.
(just saying)"
56958,"Y2 CS student here. How much salary can we expect for a summer internship? Let's say at an above avg company for an avg student. Also, I guess we can't negotiate with employers for an internship salary?"
56957,so I have bf who i've been quite loyal to but recently i've started having feelings for my best frnd. i'm sure if i tell my bf he'd be very angry. but i like my best frnd more now. what to do? we've been dating 2 yrs now and i almost made out with my best frnd alr.
56955,"Hello! Would just like to ask what does ""preclusion"" mean? Does it mean that I cant take the module if I have taken the preclusion BEFORE or that I cant take the module WITH the preclusion or both of these cases? Thank you!"
56954,Guys is IS1103 webcasted?
56953,"Hi everyone! Has any of yall taken GEH1074 Luck? I tried searching for its module reviews online but haven't had much luck. Just wanted to find out more about its workload, especially the readings. Thanks in advance!! "
56952,"Is there a minimum number of MCs to read in my FYP year? Planning my schedule and was wondering if I'm allowed to read only one more module that semester, which means that's 8 MC for one semester. "
56950,"Jobless 2nd upper nus grad here... I am very stressed out now. Graduated last year. Have been applying all kind of jobs. 

But I am pes c and can't sign on. At this point, I am really going crazy. I study hard, and did everything that is required but still couldn't get a job. 

Is there any hope? Or am I gonna just linger around till I am old? How long do you take to find your first job?"
56949,"I don't understand what the hoohah abt regarding nus communications and new media is about. 

We are a global university centered in Asia. Not a copycat. Why should we follow LSE， Umich, Upenn modules offering.  We chose nus because it is relevant to Asia. We should develop our distinctive styles and focus on research that is relevant for Singapore and Asia, rather than being copycat and doing focusing on areas that are already popular in the West, although this will get lots of citations, and improve fass ranking"
56948,"To #56195: I took GEH1036 last sem, and I wasn't from Math olympiad but scored A. The math is not fundamentally hard, but you gotta be extremely careful. I scored 20/20 for midterms (30%) and 29/30 for finals (70%) and got an overall score of 97.6 / 100 but still didn't get A+, so you can tell how steep the curve is. Makes sense considering the questions are all true/false. ATB!!　 "
56947,Has anyone been in a situation where you previously dropped a pre-allocated mod but it is no longer offered anymore afterwards and is a degree requirement? Pls advise!!
56943,"What is your opinion about guys who went to visit a prostitute, even just once? Do you find them disgusting? Or you don't care? And what if your partner admitted that they had gone to such a place before? Are such guys destined to be shunned in society? Or it's still ok as long as they are still safe?"
56941,Has anyone been to NUS UCS before? I'm thinking of going there as I'm afraid that I may have depression or some other minor forms of it. Can anyone share their experiences if it's not too private? 
56940,"CAP is about 3.9 right now. I'm in Year 3 now, guess I had some pretty bad semesters due to mental health issues but I'm slowly getting better (i hope). Is it still possible to raise it up to a 4.5? Has anyone done it? It's a bit scary, only having 3 more semesters left and no S/U."
56939,"Hello, 
How does module mapping for summer programs work? On what basis will mappings be accepted or rejected? What kind of module mappings are likely to get accepted? Is it possible to map one major mod and one UE for summer school even though I am already lagging behind in fulfilling the requirements for my major?

Thank you for taking the time to reply:)"
56936,Do we get P & G account points refill when on an exchange? I found myself have a few hundreds fewer points so can't win a bid in CORS.
56935,"Hi, are there any useful sources of C programming tasks for me to practice with? Such as the ones that are available on Codecrunch. I can't access them anymore because my CS1010E module ended. "
56934,"Hi guys, I'm a  freshman CS major. The vNP program sounds kinda interesting to me so I'm thinking about pursuing it. Meanwhile, a 1-year NOC at SV is appealing too .... 
I cannot afford to take up an extra year so I think I can only target one of those two. May I have opinions from nice seniors pleasee ? Thanks a bunch"
56933,Is it true that the point system will be gone next sem? Urgent! It affects the module imma bid for.
56931,Am I the only one really annoyed with the way the engineering department is handling the issues with EG2041A? seems like everyone is having trouble bidding for it. They aren't letting us know what they're doing to address it and how we should proceed. 
56929,To #56195: So im intending to take GEH1036 this sem but what most of the reviews said was that it would be easier if i was from mathematics olympiad during sec/JC... But i wasn't. So is it recommended for me to take this mod given that i did pretty well for my H2 Maths? Thanks :)
56928,Data science workshops like those teaching Python are trending. Is it really beneficial if I attend one in the holidays?
56926,"I went from ite to poly then to nus. In between also got ns. So I am one of the older students in nus.

I am in my late 20s and will be graduating this semester. Just wanted to ask if my age will affect me entering public service jobs for fresh graduate. Very stressed out over age..."
56925,"Hello, does anyone know what it is like to apply for LOA (leave of absence) on medical grounds? I've been referred to see the UHC psychiatrist but I don't know how strict or biased they are against mental heath related reasons for applying for LOA. "
56924,I'm in love with this amazing girl I just met at the start of this sem but I know that she has a boyfriend and she's very loyal. Somehow we drifted apart and now we never talk anymore. She was a really great friend and we clicked so well. Everyday I miss her :(
56923,Should I take CS1010E in Semester 2? Heard that the lecturer is not as good as the one in Semester 1.. Or should I take it at summer school instead? Will it affect any future mods I take? 
56921,Shoutout to Ryan Ch’ng from the NUSSU ExCo - I really like reading your blog about the NUS shuttle buses.  Please keep writing more!
56920,"I just realise these days, employers will prefer someone who gone through many failures and eventually becoming successful in life to someone who is successful all the time "
56919,"Hi! Quick question regarding UEMs! Since Round 3A and 3B only starts next Mon and Tues, am I supposed to attend the lectures  before getting confirmation? "
56918,"I didn't do any internship during university. Am I screwed? I spent my holiday working some retail/sales jobs. But I am from STEM, can I even put it in my resume?

Imagine a lab looking at my resume and instead of lab techniques, I have some skill selling clothes... Sigh. fml."
56917,"hi confused business student here. for general ed mods, it says on website

The ULR consists of 
(a) 2 General Education (GE) Modules, 
(b) 1 Singapore Studies module and 
(c) 2 Breadth modules (i.e. electives outside Business School).  

GE Modules cover two broad subject groups: 
Subject Group A: Science and Technology 
Subject Group B: Humanities and Social Sciences 

BBA students are required to read at least one GE Module from Subject Group A, including polytechnic diploma holders who are granted advanced placement for one GE Module.

what does these mean?and what kind of ge mods we are assigned? i only know GER so far"
56915,"For those asking and commenting about GEH1036 Living with Mathematics, do note that much of the information out there is outdated. In AY18/19 Sem 1 (the sem that just ended), Prof Gan Wee Teck changed the syllabus, and judging by his usual style, that module probably became less easy. "
56914,So im a yr 1 student here with a cap of 3.75 after finishing sem 1... I feel that it is not good cuz my friends from other majors are doing pretty well with a cap of 4.5... I want to graduate with a cap of 4.5 but with just sem 1 being over i doubt i can... Any advice on this? Like is it still possible for me to achieve a cap of 4.5 in the future?
56911,"Has anyone joined Engineering UROPs before, particularly for chemical eng? Still in Y1, and planning to take this as UEM would like to listen to opinions and advices. Thank you."
56910,Is it possible to get a first-year internship? I read through the job descriptions and I cannot fulfill most of the technical requirements...
56909,What's guys opinions on short hair girls? I'm an average looking girl with short hair (really short hair that kinda resembles guy hairstyle). I am well aware that guys like girls with long hair more but would really want to find out guys' opinions on girls with short hair. I really love my hair and am not planning to grow it long cuz it's my style and I feel comfortable and confident with my current hairstyle. 
