tag,text
62719,"Hello #62810, I'm #62719. 

You asked, ""how did you decide to leave your previous relationships and what made your current one different?""

Sometimes you meet the right person but at the wrong time. I guess my current one is the right one who appeared at the right time.

I started dating my first ex when we were both 18. We shared many common interests, which got us closer. 

However, as we got closer, I started to see how different we are. These differences often led to arguments. 

I got tired of the endless quarrelling. I felt like we are very different people and I didn't know how to resolve the issues we faced as I didn't know how to communicate well.

Maybe I thought I could find someone who would suit me better. And when this someone appeared, I felt that it was time to leave the rs. 

My second ex was a very sweet, kind and caring guy. We would spend almost every day together and prioritise our rs above everything else.

Along the way, we lost ourselves. We were trapped in our own tiny bubble. We neglected our own social circle and personal life. 

Initially this tiny bubble felt very much like a comfort zone you don't want to get out of. But eventually it felt rather suffocating.

One day you realise you don't know who you are anymore. You are probably just somebody's girlfriend. And suddenly you feel like maybe you want a guy who actually has a life of his own. And when that guy came along, I knew this rs has to end. 

Third ex - smart, funny, sociable, outgoing. All these came at a price. He has alot of female friends, many of whom happen to be quite pretty. He would hang out with them pretty often. 

I felt quite insecure whenever he goes out with these friends. I knew I wasn't confident of myself. I felt his friends are more fun and better looking than me.

I got tired of feeling insecure all the time. And when I met someone who seems like the more serious type of guy, I decided to end my rs. 

This serious guy is my current one and hopefully my last one. lol.

How is he different? Like what I said before, he's a pretty average guy and the only not so average thing about him is his love for me. 

His love is like a burning charcoal. It burns slowly but steadily. Day by day, he tries to learn more and more about me and find ways to show that he cares. Slow and steady wins the race right? 

My first ex taught me the importance of communication. My second ex taught me the importance of independence. My third ex taught me the importance of confidence. My current one taught me love. 

They are all perfect in their own ways. It's just that I met them at different stages of my life. It happens that when I met my current one, I was more ready for a relationship.

You meet different people for a different reason. Just because the relationship ended, it doesn't mean the relationship wasn't real. 

You would always have something to learn from the people you meet. Along the way, you learn to become a better person. And when the time comes, you will be ready to love and meet someone deserving of your love. 





































"
62718,Has anyone successfully overloaded for special term before (taken more than 2 courses in special term I or II)? Do you think they would allow it since I'm due to graduate this academic year? 
62717,"I find that SMEs are a great place to learn a wide range of roles and skills from scratch.

But at the same time, due to the low barrier to entry, leadership can be hit or miss.

Have heard horror stories of interns being made to work overtime up to midnight, being micromanaged by upper management on internal company chat, and their projects being filed and never continued or developed by full-timers or subsequent interns after their internship period ends (meaning that their internship was only for show and didn't actually contribute to company results).

Would you intern with an SME in Singapore? Why/why not?
"
62713,What happens if you fail a module that is only offered in semester 2 but you are due to graduate this semester? Will NUS allow an exception for you to repeat the module next semester? 
62712,Just found out about the study spaces at YIH. I think it would be cool if NUS better advertised where study spaces are. Perhaps with posters advising people where else they can go to study?
62709,What's the difference between Bachelor of Computing (Computer Science) and Bachelor of Science (Computer Science)?
62708,"My friend in USP told me about this senior who always tries to be relevant and voices out his ""concern"" for the community and loves kicking up a big fuss over tiny things (e.g. whether there is enough food in the welfare pack) in an effort to seem critical-thinking and smart... but he doesn't know everyone looks down on him and talks behind his back... >< why do people act like this???"
62707,"Next week will be my last at RVRC. I would like to thank all the cleaners for putting up with our sh** (literally and figuratively), my super cool neighbors for the games and movie nights we had, and the mysterious person who always refills the kitchen with sponges and dishwashing liquid (you da mvp!)"
62705,lol those who took ME2121 thermo how did y’all find it? I thought it was hard could barely do two questions
62704,Anyone took GET 1023 Thinking Like an Economist before??? Can share what are the final questions like if u don't mind? No PYP released :((((((
62702,"Hi, I'm the OP of #62702, to the guys, I'm not saying that your little brother gets to decide everything. But he does help you greatly and it's crucial in your 1st stage of decision making process. Subsequently, there are other factors to take into consideration such as personality, financial and beliefs wise. The last stage will be of course to get your girl to say 'I Do' to you and your little brother. Marriage is a mutual consent between both parties and their corresponding siblings and parents too. Lastly, if your little brother gives a firm and hard 'Yes' to every girls, then I think either you are worse than a beast or something is seriously very wrong with yours. Please get yours for a thorough checkup at the nearest clinic as soon as possible before it's end game."
62701,"Facebook is launching a Secret Crush feature that lets you add friends as secret crushes and match people if there are mutual secret crushes! If I add everyone I know into my Secret Crushes list, will I get a ????% match rate? ????

https://www.theverge.com/2019/4/30/18522924/facebook-f8-secret-crushes-dating-app-hinge-feature"
62700,"Hi I am looking for a genuine advice here with regards to major switching.

I have now finished my degree in chemical engineering. 
But is it possible to start afresh on other engineering degree such as mechanical or electrical? Would that be unrealistic?
Are there any of you out there who underwent such transformation? Is there even a recognized programme or bridging course for this purpose?  (I am at least glad that there are some cs courses which allow complete transition)

"
