tag,text
61206,"Hi all,

I'm an NUS undergrad, whose faculty does not comment on NUSWhispers often (always studying). My seniors are way too busy and don't come to school most of the time so they don't really read this page. But I do read this page for entertainment sake and let me say that I really love this page. The thought processes and reasoning evident by the unique netizens in the comment section here is well... unique. Needless to say, it is very different from the opinions and arguments which my faculty mates and I have (by many many many miles).

In my faculty, brains and critical thinking are a must if I want to communicate effectively with my peers, and not receive those judgemental ""what are you talking about"" eyes.
Here, it seems that the same method of argument does not apply! If the amygdala hijack mechanism taught briefly in school needs a prime example, most of the netizens here would be it.

Personally, the comments here are like a break from work. In school, I analyse different problems and pains people face, and how I could better help them when they consult me. But here, I look at the arguments/advice posed by netizens, and try to reason out these thought processes.

Let me tell you, the latter is undoubtedly more puzzling, albeit infinitely more entertaining.

Go ahead, criticise my imperfect enGRISH.

Regards.
Someone from a faculty near the Science Canteen

P.S. The category of netizens does not include persons such as Prof Ben, who I feel are a great source of help and encouragement. The fact that he even bothers answering the relevant students on this page despite it mostly seeming like a human talking to mealworms (in terms of mental capacity) is just great."
61205,"I am staying at one of the Residential Colleges and Chartwells really does have full monopoly power over the provision of meals under the meal plan. In light of the recent news of the food poisoning case, meal plans should be reviewed and made optional given that students do not have a choice in company that is providing catering services."
61202,Anyone else finds the compulsory meal plans in rc stupid and costly + i dont see many people bonding/ interacting during meals. Coupled by the fact that the recent spike of gastroentirits cases..will the management be responsible for outbreaks like this and lapses in food safety protocols..
61200,"Watching your Instagram story has became part and parcel of my life.

It has been a week since you blocked me from Instagram, but I never gave up hope that you will unblock me some day 

My life doesn't feel the same again after you blocked me from Instagram

I wish time would freeze during the period where you didn't block me from Instagram, even if that means that I can never get to watch Avengers: Endgame"
